Booth Number(s),Company Name,Link to Company,Description,Website link,Company Contact Information
4113,2b-special GmbH,"=HYPERLINK(""https://spie.org/ExhibitorDetail?ExpoID=5008&ExhibitorID=102716"")","2b-special is a manufacturer of optical fiber preforms based in Jena, Germany’s center of the optics industry. The company develops and produces custom-designed, ultra-pure specialty glass for fibers required in various applications. These include machining, medical, lighting, sensing applications and beyond – anywhere in the world where fibers are an essential component. Our organization is streamlined to produce high quality preforms customized to your specific needs.","=HYPERLINK(""http://www.2b-special.de"")",2b-special GmbH  Sophienhoehe 1 B  Jena  Germany  07749
5447,3D AG,"=HYPERLINK(""https://spie.org/ExhibitorDetail?ExpoID=5008&ExhibitorID=102754"")",Your innovation and development partner in micro and nano technologies. We are your dedicated team equipped with the tools and services to transform your structure from lab scale to industrial replication for next-generation products.,"=HYPERLINK(""http://3dag.ch"")",3D AG  Laettichstrasse 4a  Baar  Switzerland  6340
2525,3L Systems,"=HYPERLINK(""https://spie.org/ExhibitorDetail?ExpoID=5008&ExhibitorID=101686"")","3L Systems is a South Korean manufacturer specializing in precision optics for defense and commercial sectors worldwide. Our team of manufacturing professionals has developed hundreds of customized solutions during our nearly 20 years of experience. We also excel in high-speed mass production, delivering exceptional quality, reduced lead times, and competitive pricing. Our comprehensive services include design, processing, coating, assembly, inspection, and stringent quality assessment.","=HYPERLINK(""http://www.3l-systems.com"")","3L Systems  13750 E Rice Pl Ste 103  Aurora, CO  United States  80015-1059"
1753,3photon,"=HYPERLINK(""https://spie.org/ExhibitorDetail?ExpoID=5008&ExhibitorID=101868"")","3photon stands in front of optical coatings and polishing facilities by design and commerce of laser & non-linear crystals and optical components. Experience combined with technology enables us to process various hardness and sensitivity crystals. Wide range of E-beam and IBS coatings up to 20 000 nm. UV-VIS-IR crystals, such as LBO, BBO, DKDP, PPKTP, BGGSe, AGSe, ZGP, Cr:ZnSe, Fe:ZnSe, Nd:YAG, Nd:YVO4, etc. Optical components such as broadband mirrors, dichroic separators, and beamsplitters.","=HYPERLINK(""http://www.3photon.com"")","3photon  Mokslininku St 6A , 3rd Flr  Vilnius  Lithuania  08412"
4947,"3SAE Technologies, Inc.","=HYPERLINK(""https://spie.org/ExhibitorDetail?ExpoID=5008&ExhibitorID=101909"")","3SAE Technologies specializes in developing, manufacturing, and distributing high-performance equipment for fusion splicing, glass processing, and fiber preparation. Our expertise includes high-power fiber optic lasers, fused fiber components, and specialty fiber splicing. Contact us to learn more about our solutions for your optical communications, R&D, or manufacturing applications. Visit us at booth 4947.","=HYPERLINK(""http://www.3sae.com"")","3SAE Technologies, Inc.  416 Mary Lindsay Polk Dr Ste 511  Franklin, TN  United States  37067-6212"
5002,3W Photonics,"=HYPERLINK(""https://spie.org/ExhibitorDetail?ExpoID=5008&ExhibitorID=102565"")","3W Photonics is based in California. We have accumulated nearly 20 years of experience in supplying solid-state laser crystals and optical components.We are a manufacturer of high quality Laser Crystals (Nd:YAG, Nd:YVO4 Nd:YLF,Nd,Ce:YAG and Cr4+:YAG) and Nonlinear Optical Materials(RTP, CLBO, LBO, BBO and KDP) ,Acoustic-Optic devices (Q-switches, Free-Space Modulators) and Laser optics(Mirrors,Lens) are also available.","=HYPERLINK(""http://www.3wphotonics.com"")","C  1444 11th St  Santa Monica, CA  United States  90401-2908"
1849,4D Technology Corp.,"=HYPERLINK(""https://spie.org/ExhibitorDetail?ExpoID=5008&ExhibitorID=102238"")","4D Technology is a global leader in the design and manufacture of vibration-insensitive, portable and automated dynamic laser interferometers, optical profilers, and optical surface gauges. Our systems provide precise measurement of surface features, roughness, and defects - even in the most challenging environments. Serving: precision machined surfaces, optics, astronomy, aerospace & defense, space-based telescopes, optical communications, automotive, and in-line production measurements.","=HYPERLINK(""http://www.4dtechnology.com"")","4D Technology Corp.  3280 E Hemisphere Loop Ste 146  Tucson, AZ  United States  85706-5039"
5029,AA OPTO-ELECTRONIC,"=HYPERLINK(""https://spie.org/ExhibitorDetail?ExpoID=5008&ExhibitorID=103471"")","AA OPTO-ELECTRONIC proposes one of the most complete range of standard Acousto-optic components and associated Radio frequency drivers. AO devices cover wavelengths from 180 nm to 11 µm. These products are available for rapid delivery in any quantity. The range of RF drivers cover from DC to 3 GHz and up to 500 W. These drivers are matched to AO devices. Modulators, Deflectors, Frequency shifters, Fiber pigtailed devices, Pulse pickers, AOTF... Power amplifiers, Frequency sources.","=HYPERLINK(""http://www.aaoptoelectronic.com"")",AA OPTO-ELECTRONIC  18 rue Nicolas Appert  Orsay  France  91400
1062,Abrisa Technologies,"=HYPERLINK(""https://spie.org/ExhibitorDetail?ExpoID=5008&ExhibitorID=101885"")","Abrisa Technologies, a US HEF Photonics company, supplies custom fabricated glass & precision coatings for: UV to IR, electro-optics, damage resistant wide-angle sensor/scanner windows, ITO EMI shields/heaters, display glass, autoclavable mirrors, filters for NVIS, machine vision, defense, security/surveillance & access to all HEF Photonics components, lithography & laser processing. Solutions for Imaging/Sensing, Semiconductor, Micro-Electronics, Defense/Avionics, Displays, Industry, Photonics","=HYPERLINK(""http://www.abrisatechnologies.com"")","Abrisa Technologies  200 S Hallock Dr  Santa Paula, CA  United States  93060-9646"
153,"ABTech, Inc.","=HYPERLINK(""https://spie.org/ExhibitorDetail?ExpoID=5008&ExhibitorID=102977"")",No Description Found,"=HYPERLINK(""http://abtechmfg.com"")","ABTech Inc  126 North Rte 12  Fitzwilliam, NH  United States  03447"
5329,"AC Photonics, Inc.","=HYPERLINK(""https://spie.org/ExhibitorDetail?ExpoID=5008&ExhibitorID=101624"")",No Description Found,"=HYPERLINK(""http://www.acphotonics.com"")","AC Photonics Inc  2701 Northwestern Pkwy  Santa Clara, CA  United States  95051-0947"
4830,Access Laser Co.,"=HYPERLINK(""https://spie.org/ExhibitorDetail?ExpoID=5008&ExhibitorID=102243"")",No Description Found,"=HYPERLINK(""http://www.accesslaser.com"")","Access Laser Co  2211 W Casino Rd Unit A1  Everett, WA  United States  98204-1456"
227,AccuCoat Inc.,"=HYPERLINK(""https://spie.org/ExhibitorDetail?ExpoID=5008&ExhibitorID=101470"")","AccuCoat Inc. specializes in optical thin-film coatings for plastic, metal and glass optical substrates, in addition to coating various IR materials including chalcogenides. Established in 1999, AccuCoat Inc. produces a wide range of coatings from UV to IR wavelengths, including anti-reflective, beamsplitter, hot and cold mirror, filter, and metallic coatings, plus custom options. Based in Rochester, NY, AccuCoat Inc. provides high-quality end products coupled with top-tier customer service.","=HYPERLINK(""http://www.accucoatinc.com"")","AccuCoat Inc.  111 Humboldt St Ste 8  Rochester, NY  United States  14609-7415"
1853,Accumold,"=HYPERLINK(""https://spie.org/ExhibitorDetail?ExpoID=5008&ExhibitorID=102223"")","Accumold® is a high-tech manufacturer of precision micro, small, and lead frame injection moulded plastic components. With 40 years of experience and over 7,000 projects completed, we have established ourselves as World Leaders in Micro-Mold® Manufacturing Solutions.","=HYPERLINK(""http://www.accu-mold.com"")","Accumold  1711 SE Oralabor Rd  Ankeny, IA  United States  50021-9412"
4639,Acktar USA,"=HYPERLINK(""https://spie.org/ExhibitorDetail?ExpoID=5008&ExhibitorID=102332"")","Acktar specializes in the development and production of high-performance black coatings designed for stray light suppression from EUV to FIR. Recognized globally as the gold standard in black coating technology, Acktar provides cutting-edge solutions that meet the demands of industries requiring precision, reliability, and durability under extreme conditions, including semiconductors, space, automotive, photonics, lasers and medical devices.","=HYPERLINK(""http://acktar.com"")","Acktar USA  696 San Ramon Valley Blvd # 334  Danville, CA  United States  94526-4022"
"511, 512",Acqiris SA,"=HYPERLINK(""https://spie.org/ExhibitorDetail?ExpoID=5008&ExhibitorID=101524"")","Acqiris is a leading global solution provider for high-speed signal acquisition and processing for worldwide Original Equipment Manufacturers (OEMs) and Research Laboratories. Since 25 years, we have developed innovative high-performance data acquisition solutions based on DAQ card (a.k.a digitizers, ADC) with real-time signal processing dedicated to medical/industrial imaging, SS-OCT, A-OCT, LiDAR, Fiber Optic Sensing systems. Visit us to learn more about our DAQ solutions for SS-OCT.","=HYPERLINK(""http://www.acqiris.com"")","Acqiris SA  Chemin des Aulx 12, Plan-les-Ouates  Geneva  Switzerland  1228"
5314,Admesy B.V.,"=HYPERLINK(""https://spie.org/ExhibitorDetail?ExpoID=5008&ExhibitorID=102040"")","Admesy, founded in 2006 in The Netherlands, is a well-known brand for a wide range of user-friendly and robust light and color measurement devices, suited for analytical applications and display measurements. We provide customers with innovative solutions for production processes, test and measurement, automated inspection and analysis. Our colorimeters, spectrometers, light meters and 2D imaging devices are fast, accurate and reliable: measurement power stuffed in a solid black box.","=HYPERLINK(""http://www.admesy.com"")",Admesy B.V.  Sleestraat 3  Ittervoort  Netherlands  6014 CA
1464,ADOS-tech,"=HYPERLINK(""https://spie.org/ExhibitorDetail?ExpoID=5008&ExhibitorID=101854"")","Based in Lithuania, ADOS-TECH has over 12 years of experience in developing infrared optical devices, including thermal and night vision imagers. Under the IRVI brand, we design advanced IR viewers and cameras that offer practical, reliable alternatives to expensive semiconductor technologies like InGaSb/GaAs. Our focus is on delivering high-performance infrared solutions that meet the demands of scientific and industrial applications.","=HYPERLINK(""http://www.ir-viewers.com"")",ADOS-tech  Mokslininkų st. 6B  Vilnius  Lithuania  08412
1941,AdTech Ceramics,"=HYPERLINK(""https://spie.org/ExhibitorDetail?ExpoID=5008&ExhibitorID=101620"")","AdTech Ceramics is a fully integrated US manufacturer including custom designs, tape casting, multi layer ceramic processing, brazed assemblies, plating, and metal/ceramic packaging. AdTech Ceramics specializes in mission-critical ceramics for challenging environments. Our 100,000 sq ft facility has the capacity to support prototyping to high volume requirements. We engineer the finest quality ceramics, making them #STRONGDURABLEPRECISE. * ITAR registered * CUI trained * AS9100D * NADCAP","=HYPERLINK(""http://www.adtechceramics.com"")","AdTech Ceramics  511 Manufacturers Rd  Chattanooga, TN  United States  37405-3203"
130,"AdTech Photonics, Inc.","=HYPERLINK(""https://spie.org/ExhibitorDetail?ExpoID=5008&ExhibitorID=102066"")",No Description Found,"=HYPERLINK(""http://www.atoptics.com"")","AdTech Photonics Inc  18007 Cortney Ct  City of Industry, CA  United States  91748-1203"
555,"AdValue Photonics, Inc.","=HYPERLINK(""https://spie.org/ExhibitorDetail?ExpoID=5008&ExhibitorID=102081"")","AdValue Photonics manufactures high performance and cost-effective fiber lasers and related components. Product offerings range from 0.5µm, 1.0µm, 1.5µm and 2.0µm in wavelength to femtoseconds, picoseconds, and nanoseconds in pulse width; used in industrial materials processing, LIDAR, sensing, frequency conversion, spectroscopy, and medical applications. The company also has special expertise in high peak power, pulse energy, beam quality, and spectral coherence in fiber-based systems.","=HYPERLINK(""http://www.advaluephotonics.com"")","AdValue Photonics, Inc.  2700 E Bilby Rd Ste 100  Tucson, AZ  United States  85706-4580"
3314,Advance Reproductions Corp.,"=HYPERLINK(""https://spie.org/ExhibitorDetail?ExpoID=5008&ExhibitorID=101503"")","Advance Reproductions is a world-class provider of photomasking and photoplotting services, and unique photolithography solutions. Backed by a smart and creative technical team and driven by a commitment from the very first call to solving customers’ problems, we’ve built a reputation for delivering the most innovative photomasking solutions with high precision and speed.","=HYPERLINK(""http://www.advancerepro.com"")","Advance Reproductions Corp.  100 Flagship Dr  North Andover, MA  United States  01845-6117"
5223,Advanced Fiber Resources (Zhuhai) Ltd.,"=HYPERLINK(""https://spie.org/ExhibitorDetail?ExpoID=5008&ExhibitorID=101731"")",No Description Found,"=HYPERLINK(""http://www.fiber-resources.com"")","Advanced Fiber Resources (Zhuhai) Ltd  No 399 Chuangxin 3rd Rd  Zhuhai, GD  China  519080"
4205,advanced fiber tools GmbH,"=HYPERLINK(""https://spie.org/ExhibitorDetail?ExpoID=5008&ExhibitorID=103167"")",No Description Found,"=HYPERLINK(""http://www.advanced-fiber-tools.de"")",Advanced Fiber Tools GmbH  Bornheimerstr 4  Mittweida  Germany  09648
260,Advanced Glass Industries,"=HYPERLINK(""https://spie.org/ExhibitorDetail?ExpoID=5008&ExhibitorID=102375"")","Advanced Glass Industries, Inc. is a leading provider of custom optical blanks and components. We specialize in precision machining and heat processing, working on everything from mid-to-high volume blank production to specialized low volume optics projects.","=HYPERLINK(""http://www.advancedglass.net"")","Advanced Glass Industries  1335 Emerson St  Rochester, NY  United States  14606-3006"
4040,Advanced Illumination,"=HYPERLINK(""https://spie.org/ExhibitorDetail?ExpoID=5008&ExhibitorID=103532"")",No Description Found,"=HYPERLINK(""http://www.advancedillumination.com"")","Advanced Illumination  440 State Garage Rd  Rochester, MA  United States  05767-9739"
3572,Advanced Microoptic Systems GmbH,"=HYPERLINK(""https://spie.org/ExhibitorDetail?ExpoID=5008&ExhibitorID=101261"")",No Description Found,"=HYPERLINK(""http://www.amus.de"")",Advanced Microoptic Systems GmbH  Lebacher Str 6a  Saarbrücken  Germany  66113
2368,Advanced Micro-optics Technologies GmbH,"=HYPERLINK(""https://spie.org/ExhibitorDetail?ExpoID=5008&ExhibitorID=103291"")","Advanced Micro-optics Technologies GmbH designs and manufactures polymer micro-optics on wafer level. Main target groups for our products and services are Consumer Electronics, Automotive, Robotics, Automation and Metrology. We serve our clients with DOE and ROE solutions including illumination module assembly. A wide polymer portfolio and a long lasting design experience helps us to come to the best solution for our customers.","=HYPERLINK(""http://www.aacoptics.com"")",Advanced Micro-optics Technologies GmbH  Am Mittelrain 11  Suhl  Germany  98529
4640,Advanced Research Corp.,"=HYPERLINK(""https://spie.org/ExhibitorDetail?ExpoID=5008&ExhibitorID=102727"")",No Description Found,"=HYPERLINK(""http://arcnano.com"")","Advanced Research Corp  4459 White Bear Pkwy  White Bear Lake, MN  United States  55110-7626"
4205,Advanced Software for Laser Design (ASLD) GmbH,"=HYPERLINK(""https://spie.org/ExhibitorDetail?ExpoID=5008&ExhibitorID=103172"")","ASLD provides cutting-edge simulation software tailored for solid state laser and optical system design. Our high-performance tools enable realistic modeling of solid state laser amplifiers, resonators, and optical elements, optimizing development and reducing time to market. With intuitive interfaces, ASLD software supports a wide range of applications, including thermal lensing, beam quality, and dynamic multi-mode analysis. Ideal for laser manufacturers and research institutions.","=HYPERLINK(""http://www.asldweb.com"")",Advanced Software for Laser Design (ASLD) GmbH  Helmut-Anzeneder-Str 11  Erlangen  Germany  91052
4342,Adversis,"=HYPERLINK(""https://spie.org/ExhibitorDetail?ExpoID=5008&ExhibitorID=103529"")",No Description Found,"=HYPERLINK(""http://www.adversis.io"")","Adversis  PO Box 2953  Kalispell, MT  United States  59903-2953"
3424,"AdvR, Inc.","=HYPERLINK(""https://spie.org/ExhibitorDetail?ExpoID=5008&ExhibitorID=101625"")",No Description Found,"=HYPERLINK(""http://www.advr-inc.com"")","AdvR Inc  31948 Frontage Rd  Bozeman, MT  United States  59715-8642"
2038,Aehr Test Systems,"=HYPERLINK(""https://spie.org/ExhibitorDetail?ExpoID=5008&ExhibitorID=101925"")","Aehr Test Systems is a worldwide provider of test systems for burning-in and testing logic, optical and memory integrated circuits and has over 2,500 systems installed worldwide. Increased quality and reliability needs are driving additional test requirements and incremental capacity needs in package, wafer level, and singulated die/module level testing.","=HYPERLINK(""http://www.aehr.com"")","Aehr Test Systems  400 Kato Ter  Fremont, CA  United States  94539-8332"
2164,"Aeluma, Inc.","=HYPERLINK(""https://spie.org/ExhibitorDetail?ExpoID=5008&ExhibitorID=102069"")","Aeluma is a transformative semiconductor company specializing in high-performance technology that scales. Applications include mobile, automotive, AI, defense & aerospace, communication, AR/VR and quantum computing.","=HYPERLINK(""http://www.aeluma.com"")","Aeluma, Inc.  27 Castilian Dr  Goleta, CA  United States  93117"
4205,AEMtec GmbH,"=HYPERLINK(""https://spie.org/ExhibitorDetail?ExpoID=5008&ExhibitorID=103168"")","AEMtec is one of the global acting specialists for the development and production of a variety of precision optoelectronic products. Offering a wide technology portfolio including Wafer Back-End Services, Chip on Board, Flip Chip, 3D Integration and Opto Packaging AEMtec serves established markets. The range of services includes design and development, industrialization, qualification, prototyping (NPI), testing, serial production as well as supply chain management and after-sales services.","=HYPERLINK(""http://aemtec.com/aemtec-usa"")",AEMtec GmbH  James-Franck-Str 10  Berlin  Germany  12489
1357,"Aerotech, Inc.","=HYPERLINK(""https://spie.org/ExhibitorDetail?ExpoID=5008&ExhibitorID=101609"")","Precision motion control and automation for the most demanding manufacturing processes. Visit booth 1357 to explore popular products and solutions, including a new precise, cost-effective mini hexapod. Witness high-speed fiber alignment and cutting-edge laser micromachining demos. Don’t miss the power, control and flexibility of our high-dynamic gantry demo with active yaw control and ultra-compact Automation1 FLEX hardware—driven by our powerful yet intuitive Automation1 motion controller.","=HYPERLINK(""http://www.aerotech.com"")","Aerotech, Inc.  101 Zeta Dr  Pittsburgh, PA  United States  15238-2811"
3225,AFL,"=HYPERLINK(""https://spie.org/ExhibitorDetail?ExpoID=5008&ExhibitorID=101451"")",No Description Found,"=HYPERLINK(""http://www.aflglobal.com"")","AFL  170 Ridgeview Center Dr  Duncan, SC  United States  29334-9635"
5034,"AG Optics Co., Ltd.","=HYPERLINK(""https://spie.org/ExhibitorDetail?ExpoID=5008&ExhibitorID=101668"")","AGO is able to run optical engineering, aspherical lens manufacturing(both glass and plastic), and lens assemblies. Since we have better understandings about aspherical lens manufacturing processes, we have more freedom in technical limitation as well as cost structure. We have been producing also all-around-view monitor (AVM) lens for commercial vehicles. Fisheye lenses are AGO’s good item because aspherical lens plays a great role in reducing distortion and enables track length.","=HYPERLINK(""http://www.agoptics.co.kr/eng.php"")","AG Optics Co., Ltd.  198-7, Wangnim-gil, Seonghwan-eup, Seobuk-gu  Cheonan-si  Korea, Republic of  31008"
3587,AGC Inc.,"=HYPERLINK(""https://spie.org/ExhibitorDetail?ExpoID=5008&ExhibitorID=103066"")","Using the world’s top-class technologies cultivated through technological innovations over 110 years, AGC has continued to achieve the creation ofnew values in Glass, Electronics, Chemicals and Ceramic business areas.AGC is offering high refractive index glass, DOE, diffuser, packaging ceramics,lens, MLA, IR cut filters and optical coating forvarious industries including automotive, AR/MR, imaging, 3D sensing, LiDAR,VCSEL and optical communications.","=HYPERLINK(""http://www.agc.com/"")",AGC Inc.  1-5-1 Marunouchi  Chiyoda-ku  Japan  100-8405
1469,"Agilent Technologies, Inc.","=HYPERLINK(""https://spie.org/ExhibitorDetail?ExpoID=5008&ExhibitorID=102261"")","Agilent Technologies leads the industry with robust, reliable instruments that provide the ability to analyze, confirm and quantify substances of interest. Our workflow solutions enable you to maintain stringent practices from sample preparation, through analysis, to final report. For more information visit our website – www.agilent.com.","=HYPERLINK(""http://www.agilent.com"")","Agilent Technologies, Inc.  2850 Centerville Rd  Wilmington, DE  United States  19808-1610"
5109,"Agiltron, Inc.","=HYPERLINK(""https://spie.org/ExhibitorDetail?ExpoID=5008&ExhibitorID=101368"")",No Description Found,"=HYPERLINK(""http://agiltron.com"")","Agiltron Inc  15 Presidential Way  Woburn, MA  United States  01801-1040"
548,"AGM Container Controls, Inc.","=HYPERLINK(""https://spie.org/ExhibitorDetail?ExpoID=5008&ExhibitorID=101283"")","AGM Container Controls leads in the design & fabrication of products that protect sealed enclosures from the harmful effects of moisture, pressure, humidity & corrosion. Our products include breather valves (pressure/vacuum), desiccators, shapeable desiccant, humidity indicators, dry gas purge systems, tie downs & shock indicators. They are used in applications for defense & aerospace, electronics, electro-optical, industrial commercial markets to protect & extend the life of critical equipment.","=HYPERLINK(""http://www.agmcontainer.com"")","AGM Container Controls, Inc.  3526 E Fort Lowell Rd  Tucson, AZ  United States  85716-1705"
4118,AIM INFRAROT-MODULE GmbH,"=HYPERLINK(""https://spie.org/ExhibitorDetail?ExpoID=5008&ExhibitorID=101477"")","AIM is a leading supplier of advanced MCT IR-detectors from Vis to VLWIR and of Stirling cryocoolers. HOT detector technology combines outstanding E/O performance with minimum size, weight and power. Extended SWIR detectors meet the requirements of advanced hyperspectral applications. Bi-spectral detectors allow the temporal and spatial coincident recording of two separated wavelengt bands. AIM's highly efficient coolers are developed for HOT, 3rd Gen and space applications.","=HYPERLINK(""http://www.aim-ir.com"")",AIM INFRAROT-MODULE GmbH  Theresienstr. 2  Heilbronn  Germany  74072
4205,AIM Micro Systems GmbH,"=HYPERLINK(""https://spie.org/ExhibitorDetail?ExpoID=5008&ExhibitorID=103169"")",No Description Found,"=HYPERLINK(""http://www.aim-micro-systems.de/"")",AIM Micro Systems GmbH  Im Bresselsholze 8  Triptis  Germany  07819
233,AIM Photonics,"=HYPERLINK(""https://spie.org/ExhibitorDetail?ExpoID=5008&ExhibitorID=102242"")","AIM Photonics accelerates the transition of integrated photonics from concept to manufacturing-ready commercial and defense application prototypes. As the nation’s first complete end-to-end silicon photonic manufacturing ecosystem, we provide small and medium enterprises with crucial technology on-ramps and access to strategic U.S. government, industry, and academic communities. We also strive to create an adaptive integrated photonics workforce capable of meeting the industry’s needs.","=HYPERLINK(""http://www.aimphotonics.com"")","AIM Photonics  257 Fuller Rd  Albany, NY  United States  12203-3613"
3663,Aistana Inc.,"=HYPERLINK(""https://spie.org/ExhibitorDetail?ExpoID=5008&ExhibitorID=101653"")",No Description Found,"=HYPERLINK(""http://www.aistana.com"")","Aistana Inc  142 N Milpitas Blvd, # 383  Milpitas, CA  United States  95035-4401"
4205,AIXEMTEC GmbH,"=HYPERLINK(""https://spie.org/ExhibitorDetail?ExpoID=5008&ExhibitorID=103170"")","AIXEMTEC is your one-stop supplier for photonics assembly and test automation. We cover all needs along your value chain and product life cycle.Our machines are known for their precision, efficiency and durability. Our modular machine architecture sets new standards in flexibility and scalability for the high precision photonics assembly and test automation.","=HYPERLINK(""http://aixemtec.com"")",AIXEMTEC GmbH  Kaiserstr. 100  Herzogenrath  Germany  52134
4633,Ajile Light Industries Inc.,"=HYPERLINK(""https://spie.org/ExhibitorDetail?ExpoID=5008&ExhibitorID=101933"")",No Description Found,"=HYPERLINK(""http://ajile.ca"")","Ajile Light Industries Inc  1492B Star Top Rd  Ottawa, ON  Canada  K1B 3W6"
867,AKELA Laser Corp.,"=HYPERLINK(""https://spie.org/ExhibitorDetail?ExpoID=5008&ExhibitorID=103080"")",No Description Found,"=HYPERLINK(""http://akelalaser.com"")","AKELA Laser Corp  1095 Cranbury South River Rd Ste 14  Jamesburg, NJ  United States  08831-3411"
