Booth Number(s),Company Name,Link to Company,Description,Website link,Company Contact Information
5443,Preciseley Microtechnology Corp.,"=HYPERLINK(""https://spie.org/ExhibitorDetail?ExpoID=5008&ExhibitorID=102282"")","Preciseley Microtechnology Corporation (PMC) is a global leader in optic MEMS solutions for optical communications systems, automotive and 3D sensing applications. The company offers innovative MEMS solutions that help design engineers solve complex problems for telecommunications infrastructure, data center networks, automotive LiDAR and lighting systems, industrial LiDAR and machine vision systems, AR/XR, medical and biometrics applications.","=HYPERLINK(""http://www.preciseley.com"")","Preciseley Microtechnology Corp.  8577 Commerce Crt  Burnaby, BC  Canada  V5A 4N6"
2528,"Precision Fiber Products, Inc.","=HYPERLINK(""https://spie.org/ExhibitorDetail?ExpoID=5008&ExhibitorID=103131"")",No Description Found,"=HYPERLINK(""http://www.precisionfiberproducts.com"")","Precision Fiber Products Inc  642 Palomar St. Ste 406-137  Chula Vista, CA  United States  91911-1624"
4835,Precision Glass & Optics,"=HYPERLINK(""https://spie.org/ExhibitorDetail?ExpoID=5008&ExhibitorID=101480"")","Precision Glass & Optics provides reliable, cost-effective, high-precision optics and commercial components from 0.040 in. to 30 in. diam., thin-film coatings, custom and standard components, plus turnkey optical solutions that operate from 0.2 to 15 µm. Utilizing the cutting-edge, newly installed PR Hoffman 5400 double-sided polishing (DSP) machine, the company can polish optical components in days, rather than weeks, to deliver exceptional high-volume optics in the shortest time possible.","=HYPERLINK(""http://www.pgo.com"")","Precision Glass & Optics  3600 W Moore Ave  Santa Ana, CA  United States  92704-6835"
2000,Precision Laser Scanning,"=HYPERLINK(""https://spie.org/ExhibitorDetail?ExpoID=5008&ExhibitorID=101845"")","We specialize in high speed polygon scanning for material processing, inspection, LIDAR and biomedical applications. Our standard models have low cost and short lead time. We can also make anything required custom.","=HYPERLINK(""http://precisionlaserscanning.com"")","Precision Laser Scanning  25750 N 82nd St  Scottsdale, AZ  United States  85255-2168"
1843,Precision Optical,"=HYPERLINK(""https://spie.org/ExhibitorDetail?ExpoID=5008&ExhibitorID=102085"")","Precision Optical offers a diverse portfolio of capabilities for production of precision optical components. With reliable, efficient strategies for manufacturing many different prism shapes, sizes, materials, thin film coatings and assemblies, prototype to production. The company's success has been our commitment to expanding capabilities in all areas of optical component fabrication, giving Precision Optical unsurpassed process control and flexibility in responding to our customer requirements","=HYPERLINK(""http://www.precisionoptical.com"")","Precision Optical  320 Kalmus Dr  Costa Mesa, CA  United States  92626-6013"
1562,Precision Optics Corp.,"=HYPERLINK(""https://spie.org/ExhibitorDetail?ExpoID=5008&ExhibitorID=102168"")","Precision Optics is a vertically integrated optics company primarily focused on leveraging its proprietary micro-optics and 3D imaging technologies to the healthcare and defense/aerospace industries by providing services ranging from new product concept through manufacturing. Utilizing its leading-edge in-house design, prototype, regulatory and fabrication capabilities as well as its Ross Optical division's high volume world-wide sourcing, inspecting and production resources.","=HYPERLINK(""http://www.poci.com"")","Precision Optics Corp.  22 E Broadway  Gardner, MA  United States  01440-3338"
1372,"Precision Scan, Inc.","=HYPERLINK(""https://spie.org/ExhibitorDetail?ExpoID=5008&ExhibitorID=102283"")",No Description Found,"=HYPERLINK(""http://www.precisionscan.ca"")","Precision Scan Inc  380 Hidhurst PL  West Vancouver, BC  Canada  V7S 1K1"
1649,Precisioneers Group,"=HYPERLINK(""https://spie.org/ExhibitorDetail?ExpoID=5008&ExhibitorID=102215"")","The Precisioneers Group is a collaboration of manufacturers specializing in advanced high-tech products. From high-precision motion technology to measurement solutions and optical components. Exhibiting: piezosystem jena nano-positioning components, SIOS metrology interferometer and HeNe lasers, UHL optical video measuring microscopes, LEJ LED custom microscope lights and power supplies, Vision & Control telecentric lenses and LED lights.","=HYPERLINK(""http://precisioneersgroup.com"")","Precisioneers Group  1 Cabot Rd Ste 240B  Hudson, MA  United States  01749-3713"
4138,"Precitec, Inc.","=HYPERLINK(""https://spie.org/ExhibitorDetail?ExpoID=5008&ExhibitorID=103438"")","Precitec manufactures highly innovative sensors and optical probes for 3D metrology applications ranging from automotive, consumer electronics, medical, glass, coordinate metrology, plastics and semiconductors. Using chromatic confocal and interferometric technologies, our CHRocodile product portfolio sets the standard in contact-free thickness and distance measurements. Our product solutions deliver highly precise and ultra-fast in-process, inline and offline measurements.","=HYPERLINK(""http://www.precitec.com"")","Precitec, Inc.  28043 Center Oaks Ct  Wixom, MI  United States  48393-3344"
332,Precitech Inc.,"=HYPERLINK(""https://spie.org/ExhibitorDetail?ExpoID=5008&ExhibitorID=103223"")","Precitech provides a complete line of ultra-precision multi-axis diamond turning, grinding, grooving and milling machines for both rotationally symmetric and freeform applications in single crystal, non-ferrous and other materials. We provide additional capabilities such as servo machining with our Fast Tool Servo to enable the creation of complex shapes with exceptional form, fit and waviness. Our core machine product lines consist of Nanoform®, Freeform®, Optoform®, and Planoform®. These systems are used within the visible and infrared, optical molding, ophthalmic, mechanical component and optical telecommunications markets.","=HYPERLINK(""http://www.precitech.com"")","Precitech Inc  44 Black Brook Rd  Keene, NH  United States  03431-5040"
4119,PREIN Flagship for Research and Innovation,"=HYPERLINK(""https://spie.org/ExhibitorDetail?ExpoID=5008&ExhibitorID=102962"")","The overall objective of the Photonics Research and Innovation Flagship PREIN is to significantly improve the exploitation of excellent scientific research and to provide disruptive photonic technologies that are taken to the market by start-ups, existing SME's and large corporations.The Photonics Research and Innovation Flagship (PREIN) is a joint consortium between Tampere University, University of Eastern Finland, Aalto University and VTT Research Center of Finland.","=HYPERLINK(""http://www.prein.fi"")","PREIN Flagship for Research and Innovation  Korkeakoulunkatu 10, PL 527  Tampere  Finland  33014"
4205,PRIMES GmbH,"=HYPERLINK(""https://spie.org/ExhibitorDetail?ExpoID=5008&ExhibitorID=103268"")",No Description Found,"=HYPERLINK(""http://www.primes.de"")",PRIMES GmbH  Max-Planck-Str 2  Pfungstadt  Germany  64319
3566,"Princeton Infrared Technologies, Inc.","=HYPERLINK(""https://spie.org/ExhibitorDetail?ExpoID=5008&ExhibitorID=101779"")","Princeton Infrared Technologies, Inc. (PIRT) specializes in indium gallium arsenide (InGaAs) imaging technology, focusing on the design and manufacture of shortwave infrared cameras and 2D imaging arrays. Our products feature industry-leading sensitivity, operate at the highest commercially available frame rates and deliver exceptional Megapixel resolution. All imaging solutions are ITAR-free, ensuring global accessibility.","=HYPERLINK(""http://www.princetonirtech.com"")","Princeton Infrared Technologies, Inc.  7 Deerpark Dr Ste E  Monmouth Junction, NJ  United States  08852-1921"
3229,Princeton Scientific Corp.,"=HYPERLINK(""https://spie.org/ExhibitorDetail?ExpoID=5008&ExhibitorID=101874"")","Princeton Scientific is a leading global supplier of pure element crystals and substrates, as well as common alloys to research and industry. We supply high purity materials including metal single crystals, substrate single crystals and bi-crystals for superconductivity. We offer custom made laser crystals and optical components (coated and uncoated). Latest products include: Diamond Wire Saws, Plasma Technology, UHV Technology equipment. Please visit us at www.princetonscientific.com.","=HYPERLINK(""http://www.princetonscientific.com"")","Princeton Scientific Corp.  PO Box 148  Bethlehem, PA  United States  18044-0148"
4205,Printoptix GmbH,"=HYPERLINK(""https://spie.org/ExhibitorDetail?ExpoID=5008&ExhibitorID=103269"")",No Description Found,"=HYPERLINK(""http://www.printoptix.com"")",Printoptix GmbH  Nobelstr. 15  Stuttgart  Germany  70569
615,Prio-Optics,"=HYPERLINK(""https://spie.org/ExhibitorDetail?ExpoID=5008&ExhibitorID=103165"")",No Description Found,"=HYPERLINK(""http://www.prio-optics.com"")",Prio-Optics  Hermann-von-Helmholtz-Platz 6  Eggenstein-Leopoldshafen  Germany  76344
3431,Prior Scientific Inc.,"=HYPERLINK(""https://spie.org/ExhibitorDetail?ExpoID=5008&ExhibitorID=101342"")","Prior has the products, tools, & support to make your optical and opto-mechanical products come to life. We have an extensive line of standard & custom products that can assist you to integrate, including: high precision stages, nanopositioning devices, robotic sample handling systems, laser autofocus systems, fluorescence illumination systems, filter wheels, custom microscope stands & an array of accessories. We take your ideas from concept to manufacture to create solutions that work.","=HYPERLINK(""http://www.prior.com"")","Prior Scientific Inc.  80 Reservoir Park Dr  Rockland, MA  United States  02370-1062"
2367,Prizmatix Ltd.,"=HYPERLINK(""https://spie.org/ExhibitorDetail?ExpoID=5008&ExhibitorID=101273"")","Prizmatix Ltd. specializes in Ultra High-Power LED systems for industrial and scientific use. Featuring Ultra High Power and advanced drivers with Ultra Low Noise and fast TTL strobing, our customized Light Engines deliver high power with flexible and fast design options. We have a full range of products for applications such as microscopy, high speed imaging, automated inspection, spectroscopy and Optogenetics. Contact us for your application needing high power and precise control.","=HYPERLINK(""http://www.prizmatix.com"")","Prizmatix Ltd.  Azrieli Center, Building B floor 7  26 Harokmim Street  Holon  Israel  58588"
5412,Prodrive Technologies,"=HYPERLINK(""https://spie.org/ExhibitorDetail?ExpoID=5008&ExhibitorID=102350"")","For over 30 years, Prodrive Technologies has been a research, development, and production partner for high-end electronics in the semiconductor industry, counting with multiple manufacturing sites and sales offices. We produce everything in-house, covering all aspects of processes from start to finish and deliver the latest process techniques in cameras, motion control and integrated systems. Our mission is to create meaningful technologies that make the world work.","=HYPERLINK(""http://prodrive-technologies.com"")",Prodrive Technologies  Science Park Eindhoven 5501  Son en Breugel  Netherlands  5692 EM
4040,ProPhotonix,"=HYPERLINK(""https://spie.org/ExhibitorDetail?ExpoID=5008&ExhibitorID=103531"")","ProPhotonix designs and manufactures laser diode modules and LED illumination. With ISO-certified facilities in Ireland and the United Kingdom, ProPhotonix's solutions include LED line scan illumination, the latest in UVC LED lights for machine vision, disinfection and fluorescence, compact, reliable UV LED lamps for curing inks, coatings and adhesives, high-performance digital lasers, and a broad range of high-quality laser modules for industrial, medical, scientific and other applications.","=HYPERLINK(""http://www.prophotonix.com"")","ProPhotonix  200 Newbury St  Boston, MA  United States  02116-2504"
3310,Prospective Instruments LK OG,"=HYPERLINK(""https://spie.org/ExhibitorDetail?ExpoID=5008&ExhibitorID=101362"")",No Description Found,"=HYPERLINK(""http://www.p-inst.com"")",Prospective Instruments LK OG  Bildgasse 18  Dornbirn  Austria  6850
4205,PROTECT- Laserschutz GmbH,"=HYPERLINK(""https://spie.org/ExhibitorDetail?ExpoID=5008&ExhibitorID=103270"")","Your safety! Our concern! Since 2005, PROTECT-Laserschutz GmbH has been your reliable and qualified partner for laser, laser-welding, UV-protection and work safety. As a manufacturer we are certified according to DIN ISO 9001:2015 and employ experts with many years of experience in the optical safety and work safety sector. Our employees have a broad spectrum of knowledge about laser technology and necessary protective measures, especially regarding norms and legal requirements.","=HYPERLINK(""http://www.protect-laserschutz.de"")",PROTECT- Laserschutz GmbH  Mühlhofer Hauptstr 7  Nürmberg  Germany  90453
4205,PT Photonic Tools GmbH,"=HYPERLINK(""https://spie.org/ExhibitorDetail?ExpoID=5008&ExhibitorID=103271"")","Photonic Tools provides system components and solutions for the rapidly growing industrial ultra fast and higher power cw laser applications, their end users, system integrators and laser manufacturers. The experienced Photonic Tools team already has a long standing track record of bringing innovative tools for laser material processing to the industrial high power cw laser market.","=HYPERLINK(""http://www.photonic-tools.de"")",PT Photonic Tools GmbH  Carl-Scheele-Str. 14  Berlin  Germany  12489
3647,Pure Photonics,"=HYPERLINK(""https://spie.org/ExhibitorDetail?ExpoID=5008&ExhibitorID=101242"")","Pure Photonics is a manufacturer of low-noise tunable lasers for sensing and scientific applications. The products are based on a telecom (1550nm) platform to ensure superior quality and pricing. In addition, Pure Photonics makes Lumentum telecom products and components available to labs and other users.","=HYPERLINK(""http://purephotonics.com"")","Pure Photonics  830 Hillview Ct Ste 255  Milpitas, CA  United States  95035-4553"
2643,PWY Service GmbH & Co. KG,"=HYPERLINK(""https://spie.org/ExhibitorDetail?ExpoID=5008&ExhibitorID=103332"")","We present the optical modeling and design software VirtualLab Fusion. In addition, we offer optical design services and various opportunities to improve your VirtualLab Fusion skills in courses, online training, webinars or meetings. Optimize your products or your manufacturing process! Analyze, simulate and optimize your optical system with high speed and more physics! Specialized software e.g. for metalenses, AR / MR / XR or diffractive optics applications are available.","=HYPERLINK(""http://www.pwy-servive.de"")",PWY Service GmbH & Co. KG  Am Teich 2  Jena  Germany  07743
5029,Pyxalis,"=HYPERLINK(""https://spie.org/ExhibitorDetail?ExpoID=5008&ExhibitorID=103465"")",No Description Found,"=HYPERLINK(""http://pyxalis.com/"")",Pyxalis  170 Rue de Chatagnon  Moirans  France  38430
3487,"QD Laser, Inc.","=HYPERLINK(""https://spie.org/ExhibitorDetail?ExpoID=5008&ExhibitorID=103071"")","QD Laser, Inc. is a Japan based company, offering the cutting-edge technology in semiconductor lasers and epitaxial wafers. Our product lineup is 532 - 594 nm visible lasers, 640 - 905 nm Fabry-Perot lasers, 1 µm wavelength range DFB lasers and 1.3 µm quantum dot lasers. Our brand-new product “Lantana”, a 532, 561, 594 nm all-in-one compact visible laser with an integrated driver, will be exhibited. Stop by our booth #3487 in the Japan Pavilion to see our wide range of products.","=HYPERLINK(""http://www.qdl-laser.com/en"")","QD Laser, Inc.  Keihin Bldg 1F Laser Device Div/Sales Gr  1-1 Minamiwataridacho, Kawasaki-ku  Kawasaki  Japan  210-0855"
5213,QDI systems,"=HYPERLINK(""https://spie.org/ExhibitorDetail?ExpoID=5008&ExhibitorID=103376"")","QDI systems develops and manufactures quantum dot material and image sensors for both the X-ray and short-wave infrared (SWIR) domains. QDI systems is based in the Netherlands and has an in-house capacity to process both CMOS and TFT image sensors. Our quantum dots material and sensors are suitable for a variety of applications such as medical imaging, machine vision, defence/security, inspection, and consumer electronics.","=HYPERLINK(""http://qdisystems.com"")",QDI systems  Rozenburglaan 15  Groningen  Netherlands  9727 DL
265,QED Optics,"=HYPERLINK(""https://spie.org/ExhibitorDetail?ExpoID=5008&ExhibitorID=101822"")","QED Optics is the industry’s go-to resource for a combination of large, challenging or highly precise optical components that most other manufacturers can’t produce. QED Optics partners with you to ensure the precision components we provide will meet specification, will be optimal for use in your final application and will be delivered on time. Industries include Ground-based telescopes, Space telescopes, Astronomical instrumentation, Directed energy applications, and Research and development.","=HYPERLINK(""http://www.qedoptics.com"")","QED Optics  1000 University Ave  Rochester, NY  United States  14607-1239"
265,"QED Technologies, Inc.","=HYPERLINK(""https://spie.org/ExhibitorDetail?ExpoID=5008&ExhibitorID=102614"")","QED delivers solutions to optics manufacturers: MRF polishing machines bring efficiency and confidence to manufacturing processes. Polish large optics, up to 1200 mm, with the new Q22 family of MRF machines. Production-oriented Q-flex MRF machines finish optical components from plano to complex geometries, up to 300 mm, with repeatable precision. With SSI metrology machines measure plano to freeform geometries, up to 500 mm.","=HYPERLINK(""http://www.qedmrf.com"")","QED Technologies, Inc.  1040 University Ave  Rochester, NY  United States  14607-1282"
568,"Qingdao Higin Optics Co., Ltd.","=HYPERLINK(""https://spie.org/ExhibitorDetail?ExpoID=5008&ExhibitorID=102669"")","Xi'an Leite/Qingdao Higin, established in 2016, is a global leader in high-power diode and solid-state laser manufacturing. Our R&D team consists of top talents from leading universities with partnerships. We export to numerous countries, with applications spanning industrial processing, research, medical aesthetics, etc. Our latest picosecond and diode hair removal lasers offer significant improvements in performance and stability. Hope everyone enjoys the beauty brought by technology.","=HYPERLINK(""http://leitekeji.com"")","Qingdao Higin Optics Co., Ltd.  Rm 802 Unit 2, Bldg 217  No 2000 Binhai Rd  Qingdao, SD  China  26600"
4228,"Qingdao Lasence Co., Ltd.","=HYPERLINK(""https://spie.org/ExhibitorDetail?ExpoID=5008&ExhibitorID=101800"")",No Description Found,"=HYPERLINK(""http://www.lasence.com"")","Qingdao Lasence Co Ltd  No 18-B Xianshan East Rd Chengyang District  Qingdao, SD  China  266107"
2127,"Qingdao Spacnoble Technology Co., Ltd.","=HYPERLINK(""https://spie.org/ExhibitorDetail?ExpoID=5008&ExhibitorID=102855"")","Spacnoble manufactures a wide range of high precision spherical, cylindrical and flat optics components for OEM customers from Industries of Laser, Telecom, Biomedical instruments and Analysis instruments. We utilize different manufacturing processes including Conventional Polishing, double-sided polishing and thin film coating with IBS, IAD, EB technique.","=HYPERLINK(""http://www.spacnoble.com"")","Qingdao Spacnoble Technology Co., Ltd.  No.318, Jinshui Road, Licang District, Qingdao  318 Jinshui Road Licang District  Qingdao, SD  China  266199"
5104,QPC Lasers Inc.,"=HYPERLINK(""https://spie.org/ExhibitorDetail?ExpoID=5008&ExhibitorID=101505"")","QPC Lasers Inc. is a vertically integrated laser diode manufacturer shipping high brightness lasers globally into several markets including medical, industrial, automotive, telecom, and consumer, from its high volume 40,000 sq. ft. laser manufacturing facility located in Sylmar, CA.","=HYPERLINK(""http://www.qpclasers.com"")","QPC Lasers Inc.  15632 Roxford St  Sylmar, CA  United States  91342-1265"
3419,"QS Lasers, UAB","=HYPERLINK(""https://spie.org/ExhibitorDetail?ExpoID=5008&ExhibitorID=103537"")",No Description Found,"=HYPERLINK(""http://www.qslasers.com"")","QS Lasers UAB  Naujoji Riovoniu St 25B  Vilnius, Vilnius m. sav.  Lithuania  03153"
407,"QTEK Laser, LLC","=HYPERLINK(""https://spie.org/ExhibitorDetail?ExpoID=5008&ExhibitorID=103412"")",No Description Found,"=HYPERLINK(""http://www.qteklaser.com"")","QTEK Laser LLC  411 Waverley Oaks Rd Ste 114  Waltham, MA  United States  02452-8512"
4542,"QualiTau, Inc.","=HYPERLINK(""https://spie.org/ExhibitorDetail?ExpoID=5008&ExhibitorID=103158"")",No Description Found,"=HYPERLINK(""http://www.qualitau.com"")","QualiTau Inc  2270 Martin Ave  Santa Clara, CA  United States  95050"
138,"Quancool Intelligent Technology Co., Ltd.","=HYPERLINK(""https://spie.org/ExhibitorDetail?ExpoID=5008&ExhibitorID=102704"")","Optical library intelligent technology is a set of optical design, production and sales as one of the high-tech enterprises. The company covers an area of 11,000 square meters, products are widely used in optical imaging, biomedical, laser processing, machine vision and so on. The main products include fiber laser collimator, fiber laser focusing mirror, fiber marking field mirror, mirror, beam combination mirror, infrared thermal image lens, filter, prism, various lenses and so on.",No website link found,No Contact Info Found
3232,QuantCAD LLC,"=HYPERLINK(""https://spie.org/ExhibitorDetail?ExpoID=5008&ExhibitorID=102769"")","INFORMATION, NOT NOISE -- QuantCAD is a software startup committed to helping reduce noise. Our micrscopic noise simulation software, CADtronics, calculates the material properties in layered semiconductors to help you design the best device with minimal noise. CADtronics addresses detectivity, index of refraction, power efficiency, quantum efficiency, absorption rates, and emission rate. Learn more today by visiting our website, and stopping by our booth!","=HYPERLINK(""http://quantcad.com"")","QuantCAD LLC  5235 S Harper Ct  Chicago, IL  United States  60615"
5017,QuantIC,"=HYPERLINK(""https://spie.org/ExhibitorDetail?ExpoID=5008&ExhibitorID=103404"")",No Description Found,"=HYPERLINK(""http://quantic.ac.uk"")",QuantIC  University of Glasgow  11 Chapel Lane  Glasgow  United Kingdom  G12 8QQ
4536,Quantifi Photonics USA Inc.,"=HYPERLINK(""https://spie.org/ExhibitorDetail?ExpoID=5008&ExhibitorID=103105"")","Quantifi Photonics is a leading provider of test solutions designed to help customers unlock scalable and cost-effective high-volume manufacturing of photonic integrated circuits (PICs), co-packaged optics and pluggable optics. The company’s comprehensive portfolio includes a wide range of mixed-signal test instruments available in a benchtop, rack-mountable and PXI formats - designed to support testing at all stages of the product life cycle with a focus on high-volume manufacturing.","=HYPERLINK(""http://quantifiphotonics.com"")","Quantifi Photonics USA Inc.  13630 Immanuel Rd Ste E  Pflugerville, TX  United States  78660"
5317,Quantino,"=HYPERLINK(""https://spie.org/ExhibitorDetail?ExpoID=5008&ExhibitorID=103303"")","Quantino is a high-tech incubator specializing in optics, photonics, hardware, and medical and quantum technologies. We work with innovative high-tech businesses to revolutionize today’s industries and create tomorrow’s technologies. How do we do it? By giving our incubatees access to first-rate facilities, state-of-the-art technology, and world-renowned experts.","=HYPERLINK(""http://www.quantino.ca/fr/"")","Quantino  2740 Rue Einstein  Quebec, QC  Canada  G1P 4S4"
4342,"Quantum Composers, Inc.","=HYPERLINK(""https://spie.org/ExhibitorDetail?ExpoID=5008&ExhibitorID=103526"")",No Description Found,"=HYPERLINK(""http://www.quantumcomposers.com"")","Quantum Composers Inc  212 Discovery Dr Ste A  Bozeman, MT  United States  59718-5934"
4736,"Quantum Computing Inc.(""QCi"")","=HYPERLINK(""https://spie.org/ExhibitorDetail?ExpoID=5008&ExhibitorID=103308"")","Quantum Computing Inc.(""QCi"") built a first of its kind foundry devoted to processing thin film lithium niobate (TFLN) and other transition metal ferroelectrics in Tempe, Arizona. We closely work with our clients on conventional TFLN projects and also undertake highly custom engagements that leverage our extensive design, fabrication and characterization expertise.","=HYPERLINK(""http://www.quantumcomputinginc.com"")","Quantum Computing Inc.(""QCi"")  5 Marine View Plz Ste 214  Hoboken, NJ  United States  07030-5722"
3686,"Quantum Light Instruments, Ltd.","=HYPERLINK(""https://spie.org/ExhibitorDetail?ExpoID=5008&ExhibitorID=102847"")",No Description Found,"=HYPERLINK(""http://www.qlinstruments.com"")","Quantum Light Instruments Ltd  Mokslininku 6A-351  Vilnius, Vilnius m. sav.  Lithuania  08412"
3510,"Quantum Opus, LLC","=HYPERLINK(""https://spie.org/ExhibitorDetail?ExpoID=5008&ExhibitorID=102739"")","Quantum Opus has developed Single Photon Counting detectors based on superconducting nanowires with very high detection efficiency from 600-1550nm, low dark counts, fast timing resolution and count rates of 50Mcps. Quantum Opus provides a complete turn-key solution with a compact closed cycle cryocooler that can support up to 32 detector channels. Also provided is a portable system with one push button cooldown.","=HYPERLINK(""http://www.quantumopus.com"")","Quantum Opus, LLC  14841 Keel St  Plymouth, MI  United States  48170-6001"
