Booth Number(s),Company Name,Link to Company,Description,Website link,Company Contact Information
8525,"Mad City Labs., Inc.","=HYPERLINK(""https://spie.org/ExhibitorDetail?ExpoID=5010&ExhibitorID=101253"")",No Description Found,"=HYPERLINK(""http://www.madcitylabs.com"")","Mad City Labs Inc  2524 Todd Dr  Madison, WI  United States  53713-2317"
8661,Maiman Electronics,"=HYPERLINK(""https://spie.org/ExhibitorDetail?ExpoID=5010&ExhibitorID=101828"")",No Description Found,"=HYPERLINK(""http://www.maimanelectronics.com"")","MES SOLUTIONS DOO  Business Ctr GTC 19 Avenija  Vladimira Popovica 38-40  Belgrade, Beograd  Serbia  11070"
8311,Materion Balzers Optics,"=HYPERLINK(""https://spie.org/ExhibitorDetail?ExpoID=5010&ExhibitorID=101890"")",No Description Found,"=HYPERLINK(""http://www.materion.com/balzersoptics"")","Materion Balzers Optics  2 Lyberty Way  Westford, MA  United States  01886-3616"
8640,"Meadowlark Optics, Inc.","=HYPERLINK(""https://spie.org/ExhibitorDetail?ExpoID=5010&ExhibitorID=101622"")","Meadowlark Optics designs, develops, and manufactures polarization systems and components including liquid crystal devices from the UV to MWIR. Standard products include spatial light modulators (high power, high speed, low phase ripple), shutters, rotators, waveplates/retarders, polarizers, and polarimeters. New products include Liquid Crystal Stokes Vector Polarimeter and Liquid Crystal Polarization Gratings for remote focusing & beam steering., and high-power & high speed SLMs.","=HYPERLINK(""http://www.meadowlark.com"")","Meadowlark Optics, Inc.  5964 Iris Pkwy  Frederick, CO  United States  80504-6412"
8676,MedLight SA,"=HYPERLINK(""https://spie.org/ExhibitorDetail?ExpoID=5010&ExhibitorID=103551"")",No Description Found,"=HYPERLINK(""http://www.medlight.com"")",MedLight SA  Chemin des Larges-Pièces 6  Ecublens VD  Switzerland  1024
8570,MEETOPTICS,"=HYPERLINK(""https://spie.org/ExhibitorDetail?ExpoID=5010&ExhibitorID=102407"")","The largest database in Optics and Photonics. We help researchers and engineers to quickly find, filter, and compare optical components from global suppliers.","=HYPERLINK(""http://www.meetoptics.com"")","MEETOPTICS  Carrer Jordi Girona 1-3, C3, S 1  Barcelona  Spain  08034"
8628,"MegaWatt Lasers, Inc.","=HYPERLINK(""https://spie.org/ExhibitorDetail?ExpoID=5010&ExhibitorID=101275"")","MegaWatt Lasers manufactures application-specific solid-state lasers and components for medical, industrial, and defense applications. Standard products include a complete line of high-quality diffuse-reflector pump chambers for solid-state laser applications. Our pump chamber designs are well suited for both breadboard experimentation as well as OEM applications. MegaWatt Lasers is known for its line of Eyesafe Er: Glass microlasers for various remote sensing applications.","=HYPERLINK(""http://www.megawattlasers.com"")","MegaWatt Lasers, Inc.  PO Box 24190  Hilton Head Island, SC  United States  29925-4190"
8438,Meopta s.r.o.,"=HYPERLINK(""https://spie.org/ExhibitorDetail?ExpoID=5010&ExhibitorID=101901"")",No Description Found,"=HYPERLINK(""http://www.meopta.com"")",Meopta s.r.o.  Kabelíkova 1  Prerov  Czech Republic  750 02
8510,Micro Photon Devices S.r.l.,"=HYPERLINK(""https://spie.org/ExhibitorDetail?ExpoID=5010&ExhibitorID=102737"")","Micro Photon Devices in-depth know-how of SPAD device fabrication and active quenching electronics led the company to develop and market a comprehensive family of single photon avalanche diodes silicon, CMOS or InGaAs/InP technologies. MPD products have ultra-fast timing resolution, high photon detection efficiency, low power consumption, high robustness and reliability.","=HYPERLINK(""http://www.micro-photon-devices.com"")",Micro Photon Devices S.r.l.  Via Walter Gebert Deeg 3E  Bolzano  Italy  39100
8466,MIKROP AG,"=HYPERLINK(""https://spie.org/ExhibitorDetail?ExpoID=5010&ExhibitorID=101742"")","Mikrop is a globally operating technology leader in the area of the miniaturisation of high-precision optics. On behalf of our customers we develop, produce and assemble highly complex optical systems. With our comprehensive technical knowledge we support the need of our customers to develop even smaller, more flexible and higher performing optical devices.","=HYPERLINK(""http://www.mikrop.com"")",MIKROP AG  Industriestr 22  Wittenbach  Switzerland  9301
8302,"MKS Instruments, Inc.","=HYPERLINK(""https://spie.org/ExhibitorDetail?ExpoID=5010&ExhibitorID=102202"")","MKS Instruments enables technologies that transform our world. We deliver foundational technology solutions to leading edge semiconductor manufacturing, electronics and packaging, and specialty industrial applications. We apply our broad science and engineering capabilities to create instruments, subsystems, systems, process control solutions and specialty chemicals technology that improve process performance, optimize productivity and enable unique innovations for many of the world’s leading te","=HYPERLINK(""http://www.mks.com"")","MKS Instruments, Inc.  Suite 201  2 Tech Dr.  North Andover, MA  United States  01810"
8303,m-oem,"=HYPERLINK(""https://spie.org/ExhibitorDetail?ExpoID=5010&ExhibitorID=102101"")","m-oem is your partner for projects in applied spectroscopy, photonics, electrochemistry, and sensor systems. We provide off-the-shelf precision lasers, component spectrometers, chemical sensors and screen-printed electrodes for integration into instruments and assemblies. Our products are customizable and can be engineered and designed to meet your specific requirements. m-oem is comprised of Innovative Photonic Solutions lasers, B&W Tek spectrometers, Metroglas sensors, and Dropsens electrodes.","=HYPERLINK(""http://www.m-oem.com"")","m-oem  313 Enterprise Dr  Plainsboro, NJ  United States  08536-3344"
8671,"Nanguang Hi-Tech (Xiamen) Laser Co., Ltd.","=HYPERLINK(""https://spie.org/ExhibitorDetail?ExpoID=5010&ExhibitorID=102316"")",No Description Found,"=HYPERLINK(""http://en.ng-laser.com"")","Nanguang Hi-Tech (Xiamen) Laser Co., Ltd  No 370 Chengyi St Unit 1002  Xiamen, FJ  China  361000"
8541,Nanoscribe GmbH & Co. KG,"=HYPERLINK(""https://spie.org/ExhibitorDetail?ExpoID=5010&ExhibitorID=101852"")","We provide the most advanced, high-precision 3D printers and grayscale lithography systems with application-specific solutions. As the leading innovator and market leader in additive manufacturing, we provide application-specific solutions at the nano-, micro-, meso- and macro-scale. Our patented technology empowers cutting-edge science and drives industrial innovations in various sectors, including microoptics, micromechanics, biomedical engineering, and photonics technologies.","=HYPERLINK(""http://www.nanoscribe.com"")",Nanoscribe GmbH & Co. KG  Hermann-von-Helmholtz-Platz 6  Eggenstein-Leopoldshafen  Germany  76344
8302,Newport / An MKS Brand,"=HYPERLINK(""https://spie.org/ExhibitorDetail?ExpoID=5010&ExhibitorID=102683"")","Newport is a brand within the MKS Instruments Photonics Solutions Division. The Newport product portfolio consists of a full range of solutions including precision motion control, optical tables and vibration isolation systems, photonics instruments, optics and opto-mechanical components. For more information, visit www.newport.com.","=HYPERLINK(""http://www.newport.com"")","Newport / An MKS Brand  1791 Deere Ave  Irvine, CA  United States  92606-4814"
8340,NIH P41 CLIMB Ctr at U of I,"=HYPERLINK(""https://spie.org/ExhibitorDetail?ExpoID=5010&ExhibitorID=102361"")","The Center for Label-free Imaging and Multiscale Biophotonics (CLIMB) is an NIH NIBIB P41 Biomedical Technology Research Resource that develops cutting-edge optical and computational imaging technologies for boosting our understanding of biomedicine, from the molecular to the organism scale. CLIMB is establishing a unique technology and training hub for addressing grand challenges in biomedicine, with special emphasis in cancer diagnosis and neurodegenerative diseases.","=HYPERLINK(""http://climb.illinois.edu"")","NIH P41 CLIMB Ctr at U of I  405 N Mathews Ave  Urbana, IL  United States  61801-2325"
8401,NKT Photonics Inc.,"=HYPERLINK(""https://spie.org/ExhibitorDetail?ExpoID=5010&ExhibitorID=102003"")","Established in Denmark by scientists and engineers, NKT Photonics is based on a foundation of innovation and passion for photonics. We are the leading supplier of high-performance fiber lasers and photonic crystal fibers. We aim to make a difference in the World and are involved in projects that will transform the way we live through life science, renewable energy, and the basic understanding of the Universe. NKT Photonics is headquartered in Denmark and is a subsidiary of Hamamatsu Photonics.","=HYPERLINK(""http://www.nktphotonics.com"")","NKT Photonics Inc.  23 Drydock Ave Ste 410E  Boston, MA  United States  02210-2539"
8430,NoIR InSight,"=HYPERLINK(""https://spie.org/ExhibitorDetail?ExpoID=5010&ExhibitorID=102046"")","NoIR is a leading manufacturer of internationally certified laser safety eyewear, supplying custom solutions for new applications and energy sources, with commitment to quality and customer service. Our LaserShield® filters afford high Optical Densities without sacrificing visibility, while delivering the highest damage threshold ratings possible for femtosecond and high energy pulses. With over 130 selections available in frames to fit any face, NoIR LaserShields keep you safe and comfortable.","=HYPERLINK(""http://www.noirinsight.com"")","NoIR InSight  LaserShield  4975 Technical Dr  Milford, MI  United States  48381-3952"
8373,North American Coating Labs.,"=HYPERLINK(""https://spie.org/ExhibitorDetail?ExpoID=5010&ExhibitorID=101370"")","North American Coating Laboratories provides coatings for a variety of customers in the polymer and glass optics markets. Our experience in both dip and vacuum-applied processes make NACL one of the most respected organizations in the optical coating field. Our coating competencies include protective, reflective, anti-reflective, filter, conductive, ITO, chemically resistive, and infrared coatings. North American Coating Laboratories is an ISO 9001 certified and ITAR registered organization.","=HYPERLINK(""http://www.nacl.com"")","North American Coating Labs.  9450 Pineneedle Dr  Mentor, OH  United States  44060-1828"
8316,NovelBeam,"=HYPERLINK(""https://spie.org/ExhibitorDetail?ExpoID=5010&ExhibitorID=101753"")","NovelBeam constantly innovates on optical processing, high-energy optical coating, LED thermal management, LED driving technology, and customized illumination and imaging system design. Optical Division of NovelBeam has been adapting and improving optics technology for micro optics, IVD, stomatology, industrial laser and many other applications, offering design solutions and rapid R&D prototyping as well as high volume manufacturing with repeatable performance and reliability.","=HYPERLINK(""http://en.novelbeam.com"")","NovelBeam  No. 100 Keyuanweisi Road  Qingdao, SD  China  266100"
8681,NYFORS,"=HYPERLINK(""https://spie.org/ExhibitorDetail?ExpoID=5010&ExhibitorID=101599"")","NYFORS is your innovative supplier of advanced glass processing and preparation equipment for specialty optical fiber splicing operations. We supply reliable and precise solutions tailored to the individual challenges of our customers. Our highly automated systems lead to consistent, high yield production for both high and low volume. Our portfolio currently includes: CO2 laser splicing and glass shaping equipment, recoaters, automatic systems for preparation, fiber-end and window stripping.","=HYPERLINK(""http://www.nyfors.com"")",NYFORS  Solkraftsvägen 12  Stockholm  Sweden  135 70
8325,OFS,"=HYPERLINK(""https://spie.org/ExhibitorDetail?ExpoID=5010&ExhibitorID=102222"")","OFS is a world-leading designer, manufacturer and provider of optical fiber, fiber optic cable, connectivity, fiber-to-the-subscriber (FTTx) and specialty fiber optic products. We put our development and manufacturing resources to work creating solutions for applications in such areas as communications, medicine, industrial automation, sensing, aerospace, defense and energy. We provide fiber optic solutions that help our customers meet their needs today and into the future.","=HYPERLINK(""http://www.ofsoptics.com"")","OFS  55 Darling Dr  Avon, CT  United States  06001-4273"
8666,"Omega Optical, LLC","=HYPERLINK(""https://spie.org/ExhibitorDetail?ExpoID=5010&ExhibitorID=102190"")","Omega Optical designs, manufactures, and coats critical optical elements that guide light between source and sensor. Our Optical Filters, Diffraction Gratings, IR optics, and Custom Coating products all help to make the world healthier, safer, and more productive.","=HYPERLINK(""http://www.omega-optical.com"")","Omega Optical, LLC  21 Omega Dr  Brattleboro, VT  United States  05301-4444"
8673,Openwater,"=HYPERLINK(""https://spie.org/ExhibitorDetail?ExpoID=5010&ExhibitorID=102974"")",No Description Found,"=HYPERLINK(""http://www.openwater.health"")","Openwater  733 Front St Ste C1A  San Francisco, CA  United States  94111-1993"
8670,"Opticho Inc., Ltd.","=HYPERLINK(""https://spie.org/ExhibitorDetail?ExpoID=5010&ExhibitorID=103003"")",No Description Found,"=HYPERLINK(""http://opticho.com"")","Opticho Inc Ltd  532 Changup ground  87 Cheonam-ro  Nam-Gu, Pohang-Si  China  37673"
8206,"Optics Technology, Inc.","=HYPERLINK(""https://spie.org/ExhibitorDetail?ExpoID=5010&ExhibitorID=103025"")",No Description Found,"=HYPERLINK(""http://www.opticstechnology.com"")","Optics Technology Inc  3800 Monroe Ave Ste 3  Pittsford, NY  United States  14534-1330"
8700,optics.org,"=HYPERLINK(""https://spie.org/ExhibitorDetail?ExpoID=5010&ExhibitorID=101984"")","SPIE’s optics.org is the leading online resource for professionals using photonics based technologies, applications and for the diverse markets they serve. Delivering the very latest photonics related business news market trends and product applications to over 30,000 monthly users. Whether it’s microscopy or solar energy, materials processing or infrared countermeasures, what sets optics.org apart is its attention to the commercial side of these technology-driven industries.","=HYPERLINK(""http://www.optics.org"")",optics.org  Ffordd Pengam  2 Alexandra Gate  Cardiff  United Kingdom  CF24 2SA
8442,OptiGrate – IPG Photonics,"=HYPERLINK(""https://spie.org/ExhibitorDetail?ExpoID=5010&ExhibitorID=101563"")","OptiGrate Corp., an IPG Photonics company, is a pioneer of commercial volume Bragg gratings (VBGs) and a reliable supplier of VBGs to more than 600 customers on six continents since 1999. The key products include reflecting, transmitting, and chirped VBGs for wavelength locking and stabilization of diode lasers, mode selection in solid state and fiber lasers, ultra-narrow line optical filters for spectroscopy and imaging systems, and stretchers and compressors for ultra-short pulsed lasers.","=HYPERLINK(""http://www.optigrate.com"")","OptiGrate – IPG Photonics  552 South Econ Circle  Oviedo, FL  United States  32765-4303"
8668,Optikron GmbH,"=HYPERLINK(""https://spie.org/ExhibitorDetail?ExpoID=5010&ExhibitorID=101836"")","OPTIKRON is a partner for the development and production of micro-optical components, thin-film optics, complex optical assemblies and micro-optical systems for both medical and technical applications such as endoscopes, laser systems, sensor systems, measuring instruments and innovative applications for aerospace industry. OPTIKRON also develops and manufactures miniaturized vision-systems and high-integrated micro camera modules with sensor, optics and LED illumination in smallest dimensions.","=HYPERLINK(""http://www.optikron.de"")",Optikron GmbH  Loebstedter Str. 70  Jena  Germany  07749
8641,Opto GmbH,"=HYPERLINK(""https://spie.org/ExhibitorDetail?ExpoID=5010&ExhibitorID=102297"")",No Description Found,"=HYPERLINK(""http://www.opto-gmbh.com"")",Opto GmbH  Floriansbogen 2/4  Neuried  Germany  82061
8232,"Optolong Optics Co., Ltd.","=HYPERLINK(""https://spie.org/ExhibitorDetail?ExpoID=5010&ExhibitorID=102673"")","Founded in 1999, Optolong Optics is a technology company that design & manufacture high precise optical thin film coating filters. Products catagory: Fluorescence filter sets, Astronomy filters, also other interference filters Bandpass,Longpass, Shortpass, Dichroic mirrors,Reflective mirrors, Beamsplitter, Notch filters, Polarization filters,Neutral density filters. Involve applications of biomedical, life science,microscopy,astronomy,remote sensing,environmental monitoring,flow cytometry.","=HYPERLINK(""http://optolongfilter.com"")","Optolong Optics Co., Ltd.  Rm 1523-1526 Bldg 7  Phase II, Lenovo Tech Centre  Kepu Road  Kunming, YN  China  650101"
8217,OPTOMAN,"=HYPERLINK(""https://spie.org/ExhibitorDetail?ExpoID=5010&ExhibitorID=102576"")","OPTOMAN's mission is to be Your Sidekick for Laser Optics Development. Our core value is the desire to make application-optimised and highly customised solutions for you collaboratively and do that with ultrafast turnaround. OPTOMAN is completely concentrated on Ion-Beam Sputtering Technology (IBS) using solely in-house manufacturing capabilities run by highly skilled professionals, enabling OPTOMAN to increase the longevity and reliability of our partners‘ laser systems.","=HYPERLINK(""http://www.optoman.com"")",OPTOMAN  Ukmerges st. 427  Vilnius  Lithuania  14185
8557,OSELA Inc.,"=HYPERLINK(""https://spie.org/ExhibitorDetail?ExpoID=5010&ExhibitorID=101735"")","Osela is a specialized manufacturer of laser illumination systems and structured lighting for industrial applications in machine vision, life sciences and research. With an experienced and skilled staff knowledgeable in the area of beam shaping optics and lasers allows us to continually innovate our product portfolio offering to our customers. Based on our standard platform and our expertise, we offer very competitive customized solution specific to the needs of our customers.","=HYPERLINK(""http://www.osela.com"")","OSELA Inc.  1869 32e Ave  Lachine, QC  Canada  H8T 3J1"
8482,Oxxius SA,"=HYPERLINK(""https://spie.org/ExhibitorDetail?ExpoID=5010&ExhibitorID=101712"")","Oxxius manufactures innovative solid-state lasers for life science, spectroscopy, microscopy, holography and industrial applications. Their LaserBoxx compact lasers modules, featuring wavelengths in the UV, visible and NIR, have outstanding performance with market-leading power levels. Oxxius proposes upgradable and ultra-modular compact lasers combiners up to 7 wavelengths with multiple options.","=HYPERLINK(""http://www.oxxius.com"")",Oxxius SA  4 Rue Louis de Broglie  Lannion  France  22300
8637,OZ Optics Ltd.,"=HYPERLINK(""https://spie.org/ExhibitorDetail?ExpoID=5010&ExhibitorID=101274"")","High Power Isolators/Combiners/Patchcords/Connectors/Safety Interlocks/Shutters, Universal Optical Detection System for Pathogens, Adjustable Collimators/Focusers, Fused Fiber Couplers, Patchcords / Connectors / Splitters / Switches, Polarized Sources, Polarization Rotators / Controllers / Analyzers, Polarizers, PDL Emulators, ER Meters, Laser Diode Sources, Fiber Optic Sensors, OZ-PEN, Mode-Field–Adaptors, Components for OCT Application, Fused Collimators, Polarization Entangled Photon Sources","=HYPERLINK(""http://www.ozoptics.com"")","OZ Optics Ltd.  219 Westbrook Rd  Ottawa, ON  Canada  K0A 1L0"
8367,Pavilion Integration Corporation,"=HYPERLINK(""https://spie.org/ExhibitorDetail?ExpoID=5010&ExhibitorID=101526"")",No Description Found,"=HYPERLINK(""http://www.pavilionintegration.com"")","Pavilion Integration Corporation  2528 Qume Dr Ste 1  San Jose, CA  United States  95131-1836"
8674,PHASICS Corp.,"=HYPERLINK(""https://spie.org/ExhibitorDetail?ExpoID=5010&ExhibitorID=103520"")","Phasics offers metrology and imaging solutions to laser engineers, lens manufacturers and cell biologists. With a range covering UV to LWIR, our high resolution wavefront sensing solutions - based on the patented Quadriwave Lateral Shearing Interferometry technology - combine high accuracy, best-in-class dynamic range and ease of use. Expert software packages provide insightful analysis for R&D and manufacturing.","=HYPERLINK(""http://www.phasics.com"")","PHASICS Corp.  5277 Manhattan Cir Ste 102  Boulder, CO  United States  80303-8200"
8228,Photon Force Ltd.,"=HYPERLINK(""https://spie.org/ExhibitorDetail?ExpoID=5010&ExhibitorID=101466"")","Photon Force provides innovative single-photon sensitive detector technologies for biomedical devices involving techniques such as fluorescence lifetime imaging, multi-speckle DCS, and Raman spectroscopy. We are the leading commercial developer of CMOS single-photon sensitive time-resolved SPAD array cameras and sensors, offering the world's highest throughput. We are developing several next generation SPAD-based technologies and processing capabilities, and also provide custom sensor services.","=HYPERLINK(""http://www.photon-force.com"")","Photon Force Ltd.  Murchison House, 10 Max Born Crescent  Edinburgh  United Kingdom  EH9 3BF"
8243,Photonic Cleaning Technologies,"=HYPERLINK(""https://spie.org/ExhibitorDetail?ExpoID=5010&ExhibitorID=101442"")",No Description Found,"=HYPERLINK(""http://www.photoniccleaning.com"")","Photonic Cleaning Technologies  Bldgs 1 & 2  1895 Short Ln  Platteville, WI  United States  53818-8977"
8212,"Photonics Industries International, Inc.","=HYPERLINK(""https://spie.org/ExhibitorDetail?ExpoID=5010&ExhibitorID=103319"")","Photonics Industries International, Inc. is the pioneer of intracavity harmonic lasers, and manufactures a wide range of lasers in the nanosecond, sub-nanosecond, picosecond, and femtosecond regimes for industrial microprocessing systems and scientific research applications. Photonics Industries is a privately-held company, with manufacturing and headquarters in Ronkonkoma, New York (Lasers Made in USA: 1800 Ocean Ave, Ronkonkoma, New York 11779, USA).","=HYPERLINK(""http://www.photonix.com"")","Photonics Industries International, Inc.  1800 Ocean Ave  Ronkonkoma, NY  United States  11779-6532"
8567,Photonics Media,"=HYPERLINK(""https://spie.org/ExhibitorDetail?ExpoID=5010&ExhibitorID=102558"")","Photonics Media brings you the latest research, product information, and business news for the entire photonics industry. Our extensive resources include our award-winning publications— Photonics Spectra, Vision Spectra, and BioPhotonics — available in print and digital; the Photonics Buyers’ Guide, available in print and online; e-newsletters; webinars; conferences; a podcast; and our websites. Visit www.photonics.com for more information and to subscribe for free.","=HYPERLINK(""http://www.photonics.com"")","Photonics Media  3rd Fl  100 West St  Pittsfield, MA  United States  01201-5779"
8210,"PhotonTech Innovations Co., Ltd.","=HYPERLINK(""https://spie.org/ExhibitorDetail?ExpoID=5010&ExhibitorID=103203"")",No Description Found,"=HYPERLINK(""http://photontechinnovations.com/english"")","PhotonTech Innovations Co., Ltd.  4-1-6 Hongo  Bunkyo-ku, Tokyo  Japan  113-0033"
8634,"PhotoSound Technologies, Inc.","=HYPERLINK(""https://spie.org/ExhibitorDetail?ExpoID=5010&ExhibitorID=102658"")","PhotoSound excels in research, development and manufacturing of specialized equipment for biomedical applications based on photoacoustics. This includes specialized data acquisition systems as well as out Tritom™ Photoacoustic and Fluorescents Imaging system. All employees at PhotoSound are committed to provide every customer with the highest quality products and services with short delivery times and competitive pricing.","=HYPERLINK(""http://www.photosound.com"")","PhotoSound Technologies, Inc.  9511 Town Park Dr  Houston, TX  United States  77036-2405"
8517,PI (Physik Instrumente) L.P.,"=HYPERLINK(""https://spie.org/ExhibitorDetail?ExpoID=5010&ExhibitorID=102237"")","PI provides World-Class Precision Motion Control, Automation, Piezo Technology and Nanopositioning Solutions for Markets including: Life Sciences, Medical Engineering, Photonics, Laser Processing, Metrology, Semiconductors, Aerospace and Astronomy. Products include High-Speed Nano-Precision Scanners, Microscopy Stages, Piezo Transducers, Air Bearings, Gantries, Hexapods, Photonics Alignment, Piezo Motors and Piezo Nanopositioning Stages, High Performance Linear & Rotary Stages for OEM & Research","=HYPERLINK(""http://www.pi-usa.us"")","PI (Physik Instrumente) L.P.  Piezo Nano Positioning  16 Albert St  Auburn, MA  United States  01501-1304"
"8510, 8511, 8613","PicoQuant Photonics North America, Inc.","=HYPERLINK(""https://spie.org/ExhibitorDetail?ExpoID=5010&ExhibitorID=102170"")","PicoQuant is a leading research and development company specialized in optoelectronics and single photon counting applications. The product portfolio includes picosecond pulsed diode lasers, ultra-fast time taggers and photon counters, single photon sensitive detectors, time-resolved confocal and super-resolution fluorescence microscopes, and fluorescence lifetime spectrometers. PicoQuant drives innovation and supports the scientific community through workshops and training courses.","=HYPERLINK(""http://www.picoquant-usa.com"")","PicoQuant Photonics North America, Inc.  54 Kane St  Springfield, MA  United States  01119-2624"
8583,PIEZOCONCEPT,"=HYPERLINK(""https://spie.org/ExhibitorDetail?ExpoID=5010&ExhibitorID=101999"")",No Description Found,"=HYPERLINK(""http://www.piezoconcept.com"")",PIEZOCONCEPT  82 Avenue François Mitterrand  Bron  France  69500
8200,PMG Precision Medical Glass,"=HYPERLINK(""https://spie.org/ExhibitorDetail?ExpoID=5010&ExhibitorID=102204"")",No Description Found,"=HYPERLINK(""http://www.precisionmedical.glass"")","PMG Precision Medical Glass  810 E Saint Paul St  Litchfield, MN  United States  55355-5324"
