Booth Number(s),Company Name,Link to Company,Description,Website link,Company Contact Information
8314,Advance Reproductions Corp.,"=HYPERLINK(""https://spie.org/ExhibitorDetail?ExpoID=5010&ExhibitorID=101502"")","Advance Reproductions is a world-class provider of photomasking and photoplotting services, and unique photolithography solutions. Backed by a smart and creative technical team and driven by a commitment from the very first call to solving customers’ problems, we’ve built a reputation for delivering the most innovative photomasking solutions with high precision and speed.","=HYPERLINK(""http://www.advancerepro.com"")","Advance Reproductions Corp.  100 Flagship Dr  North Andover, MA  United States  01845-6117"
8572,Advanced Microoptic Systems GmbH,"=HYPERLINK(""https://spie.org/ExhibitorDetail?ExpoID=5010&ExhibitorID=101262"")","Manufacturer of high-quality refractive microoptic components like microlens arrays and lenslets, beam shapers and diffusers. Wafer level fabrication. Hexagonal, orthogonal, rectangular, circular, cylindrical, irregular lenslets arrangements. Convex and concave profiles.Single-side and double-side performance. Spherical and aspherical profiles. 193nm-3.5um spectral range. Numerical apertures 0.004-0.45. Pitch range: 10-4000um. Materials: fused silica, BK7, high-refractive glass types, polymer.","=HYPERLINK(""http://www.amus.de"")",Advanced Microoptic Systems GmbH  Lebacher Str 6a  Saarbrücken  Germany  66113
8225,AFL,"=HYPERLINK(""https://spie.org/ExhibitorDetail?ExpoID=5010&ExhibitorID=101449"")",No Description Found,"=HYPERLINK(""http://www.aflglobal.com"")","AFL  170 Ridgeview Center Dr  Duncan, SC  United States  29334-9635"
8219,"Alazar Technologies, Inc.","=HYPERLINK(""https://spie.org/ExhibitorDetail?ExpoID=5010&ExhibitorID=101807"")","AlazarTech manufactures high-performance PCIe waveform digitizer (DAQ) cards with data streaming rates up to 22 GB/s, and on-FPGA or GPU-based signal processing. Applications include biomedical, fiber sensing, and defense. Our unique clocking technology that allows the use of k-clocks directly for A/D conversion has made AlazarTech the de facto standard for data acquisition & signal processing in the OCT community. Come see our newest products.","=HYPERLINK(""http://www.alazartech.com"")","Alazar Technologies, Inc.  6600 Trans-Canada Hwy Ste 310  Pointe-Claire, QC  Canada  H9R 4S2"
"8553, 8630","Altos Photonics, Inc.","=HYPERLINK(""https://spie.org/ExhibitorDetail?ExpoID=5010&ExhibitorID=101803"")","Altos Photonics offers femtosecond, mode locked, and Q-switched lasers and tunable systems for research and industrial customers. Additional products include non-linear crystals (BBO, KTP, ZGP, KYW,KGW, etc.), optical mounts, USB-controlled stages, and other related products. Altos Photonics sells and services products from EKSPLA, EKSMA, Light Conversion & Standa.","=HYPERLINK(""http://www.altosphotonics.com"")","Altos Photonics, Inc.  PO Box 967  Bozeman, MT  United States  59771"
8416,"Analog Modules, Inc.","=HYPERLINK(""https://spie.org/ExhibitorDetail?ExpoID=5010&ExhibitorID=101886"")","Founded in 1979, Analog Modules, Inc. designs & manufactures a wide range of electronic products primarily for laser & electro-optics industries. AMI's products serve in military, medical, scientific & industrial applications. Laser electronic products include laser diode drivers, pulsed flashlamp drivers, cap charging power supplies, simmer supplies, Pockels cell & CW arc lamp drivers. AMI also offers a line of sensors & amplifiers, including rangefinder receivers & laser spot trackers.","=HYPERLINK(""http://www.analogmodules.com"")","Analog Modules, Inc.  126 Baywood Ave  Longwood, FL  United States  32750-3426"
8242,Andover Corp.,"=HYPERLINK(""https://spie.org/ExhibitorDetail?ExpoID=5010&ExhibitorID=102397"")","Andover Corporation is a leader in the design and manufacture of optical filters and coatings, excelling in first-surface hard coat, assembled coatings, and hybrid solutions, with superior quality and short lead times. As a vertically integrated company, we manage every step from design and fabrication to metrology, ensuring seamless project execution. We offer custom-crafted solutions with no minimum order quantities, serving diverse markets such as defense, medical devices, and astronomy.","=HYPERLINK(""http://www.andovercorp.com"")","Andover Corp.  4 Commercial Dr  Salem, NH  United States  03079-2800"
8361,"APE Applied Physics & Electronics, Inc.","=HYPERLINK(""https://spie.org/ExhibitorDetail?ExpoID=5010&ExhibitorID=101820"")",No Description Found,"=HYPERLINK(""http://www.ape-america.com"")","Applied Physics & Electronics Inc  27119 NE Bradford Rd  Vancouver, WA  United States  98682-9647"
8329,"Apollo Optical Systems, Inc.","=HYPERLINK(""https://spie.org/ExhibitorDetail?ExpoID=5010&ExhibitorID=101517"")","Manufacturer of custom precision optical components specializing in Injection molded polymer optics and single point diamond turning, both in prototype and production volumes. In-house capabilities include injection molding, SPDT, extensive metrology, coating, optical/mechanical design and engineering. AOS specializes in design and manufacturing of diffractive and refractive optics.","=HYPERLINK(""http://www.apollooptical.com"")","Apollo Optical Systems, Inc.  925 John St  West Henrietta, NY  United States  14586-9780"
8663,"Applied Image, Inc.","=HYPERLINK(""https://spie.org/ExhibitorDetail?ExpoID=5010&ExhibitorID=101920"")","Custom and off-the-shelf precision-imaged optical components, test targets & charts, calibration standards, and photo-masks to support a range of industry applications and light-based technologies, along with dicing and laser cutting/marking services. We collaborate with our customers to support the design, fabrication, evaluation, and calibration of photonics-based systems for improving product performance, first-time quality, and compliance. Rapid prototypes to production scale solutions.","=HYPERLINK(""http://www.appliedimage.com"")","Applied Image, Inc.  1653 E Main St Ste 1  Rochester, NY  United States  14609-7090"
8653,Applied Surface Technologies,"=HYPERLINK(""https://spie.org/ExhibitorDetail?ExpoID=5010&ExhibitorID=101264"")","We demonstrate precision cleaning using a CO2 Snow Jet, a quick and safe process capable of removing particles of all sizes, (visible to below 5 nm), hydrocarbons & organic residues. CO2 snow cleans all types of substrates, optics, diamond turned optics, fiber-optics, wafers, mirrors, telescopes, optical molds & many more. Recent work has shown abilities to clean new and used sensors. We demo manual, portable, & automated units for R&D & manufacturing along with new units and items.","=HYPERLINK(""http://www.co2clean.com"")","Applied Surface Technologies  15 Hawthorne Dr  New Providence, NJ  United States  07974-1111"
8537,Armadillo SIA,"=HYPERLINK(""https://spie.org/ExhibitorDetail?ExpoID=5010&ExhibitorID=101393"")","Armadillo SIA is a global supplier of specialty fiber optic solutions, offering raw fiber, pigtails, patch cords, and custom assemblies. Our in-house manufacturing process—from fiber to finished cables and assemblies—enables us to welcome challenging projects while delivering competitive pricing and quick turnaround times. Our capabilities include:Core Sizes: 40 μm to 2,000 μm; Numerical Aperture (NA) Range: 0.10 to 0.87; AR Coatings; Application Wavelength Range: 190–2400 nm and 4–18 μm","=HYPERLINK(""http://armadillosia.com"")",Armadillo SIA  Vismaņi k-2  Mārupe  Latvia  LV-2167
8440,asphericon GmbH,"=HYPERLINK(""https://spie.org/ExhibitorDetail?ExpoID=5010&ExhibitorID=102157"")","asphericon is all about passion and precision. As a market leader in the manufacturing of aspheric components and systems, we combine cutting-edge CNC technology, digital excellence, and an unwavering pioneering spirit. Together with our customers, we develop unique optical solutions for growing markets. In a forward-thinking environment, we turn ideas into reality – from the initial concept to the finished high-tech product. We shape the future of photonics.","=HYPERLINK(""http://www.asphericon.com"")",asphericon GmbH  Stockholmer Str. 9  Jena  Germany  07747
8645,Atik Cameras,"=HYPERLINK(""https://spie.org/ExhibitorDetail?ExpoID=5010&ExhibitorID=101787"")","For over 22 years, ATIK Cameras has been at the forefront of innovation,designing and manufacturing high-performance imaging solutions for the scientific, life science, and industrial markets. But what truly sets us apart? When you work with ATIK, you gain direct access to our industry experts — from software engineers and physicists to procurement specialists—who are dedicated to making your project a success.","=HYPERLINK(""http://www.atik-cameras.com"")",ATIK Cameras Ltd  Unit 8 Lodge Farm Barns  New Road  Norwich  United Kingdom  NR9 3LZ
8230,Avantier Inc.,"=HYPERLINK(""https://spie.org/ExhibitorDetail?ExpoID=5010&ExhibitorID=101806"")","Avantier is a leading provider of custom optical systems solutions with over 50 years of experience. We offer precision optical design, engineering, lens assembly, image processing, and manufacturing for applications in industries like life science, medicine, defense, aerospace, and automotive to deliver high-performance optics. Our advanced manufacturing and cutting-edge metrology ensure quality results, making us the preferred choice for optical systems with high performance requirements.","=HYPERLINK(""http://avantierinc.com"")","Avantier Inc.  1100 US-22  North Plainfield, NJ  United States  07060"
8433,"Avo Photonics, Inc.","=HYPERLINK(""https://spie.org/ExhibitorDetail?ExpoID=5010&ExhibitorID=101459"")","Avo provides Custom Design and Contract Manufacturing of Opto-Electronic Components. We enable companies to efficiently develop and sell photonic products by accelerating your ability to create, deliver and win. As your Packaging Partner, we speak photonics, from design to manufacturing. We have the tools, facilities and engineering power to take raw ideas and quickly turn them into commercially viable products. At each step in our process, you get a continuity of scientific oversight.","=HYPERLINK(""http://www.avophotonics.com"")","Avo Photonics, Inc.  510 Virginia Drive  Fort Washington, PA  United States  19034"
8202,Axiom Optics,"=HYPERLINK(""https://spie.org/ExhibitorDetail?ExpoID=5010&ExhibitorID=102450"")","Axiom Optics has been a North American distributor of high-end optical instrumentation since 2010. We are a dedicated team of engineers from various backgrounds providing technical expertise, sales and support for our customers. Our mission is to support researchers and engineers seeking solutions to the most important challenges of the 21st century including energy, space, telecommunications, climate, life science and more.","=HYPERLINK(""http://www.axiomoptics.com"")","Axiom Optics  444 Somerville Ave  Somerville, MA  United States  02143-3260"
8337,Ayase America Inc.,"=HYPERLINK(""https://spie.org/ExhibitorDetail?ExpoID=5010&ExhibitorID=101250"")","AYASE America, Inc. was established in the Silicon Valley in 2004. AYASE America, Inc. is a subsidiary of AYASE Co., Ltd., headquartered in Yokohama, Japan. Members of AYASE are composed of purchasing, sales & marketing personnel, engineers, scientists and managers who have years of experiences in laser diodes and their applications. We have close partnerships with selected world-class manufacturers of laser diodes, laser modules, optics, motors, etc.","=HYPERLINK(""http://ayasecorporation.com"")","Ayase America Inc.  One Walnut Creek Ctr  100 Pringle Ave Ste 229  Walnut Creek, CA  United States  94596-3555"
8333,"AZURE Photonics Co., Ltd.","=HYPERLINK(""https://spie.org/ExhibitorDetail?ExpoID=5010&ExhibitorID=102125"")","AZURE Photonics Co., Ltd, is an ISO 9001 certified manufacturer of customized optical components and optical assemblies. Our experienced team of technical experts also offer optical and mechanical design service for the assemblies from the very beginning your project starts. We produce a wide range of off-the -shelf and custom objective lenses working with area scan cameras/line scan cameras as well as OEM optics-lenses, Micro optics, mirrors, windows, filters, prisms and beamsplitters.","=HYPERLINK(""http://www.azurephotonics.com"")","AZURE Photonics Co., Ltd.  Bldg No 15 Haixi Science and Technology Park  Wulongjiang Middle Ave Shangjie Town Minhou County  Fuzhou, FJ  China  350108"
8203,Bandwidth10 Inc.,"=HYPERLINK(""https://spie.org/ExhibitorDetail?ExpoID=5010&ExhibitorID=102654"")",No Description Found,"=HYPERLINK(""http://bandwidth10.com"")","Bandwidth10 Inc  2080 Addison St Ste 2  Berkeley, CA  United States  94704-1693"
8605,Becker & Hickl GmbH,"=HYPERLINK(""https://spie.org/ExhibitorDetail?ExpoID=5010&ExhibitorID=103316"")","Becker & Hickl GmbH is technology leader in time-correlated single photon counting (TCSPC) since 1993. The product range includes Time Taggers, Lasers, Detectors, and Fully Integrated Systems, like Confocal Laser Scanners, capable of performing fluorescence lifetime imaging (FLIM), FCS, FCCS, FLIM FRET, clinical FLIM, DOT, fNIRS, antibunching. We supply >2000 TCSPC systems worldwide, organize 5 workshops around the world and distribute >1600 pages of TCSPC literature. www.becker-hickl.com","=HYPERLINK(""http://www.becker-hickl.com"")",Becker & Hickl GmbH  Nunsdorfer Ring 7-9  Berlin  Germany  12277
8514,BERTIN ALPAO,"=HYPERLINK(""https://spie.org/ExhibitorDetail?ExpoID=5010&ExhibitorID=101949"")","Bertin Alpao designs and manufactures a complete range of adaptive optics products for use in research and industry since 2008.Bertin Alpao understands your needs and provides you with the best components: deformable mirrors, wavefront sensors and software for your application. Our products are tailor-made for various applications such as astronomy, ophthalmology, microscopy, optical and quantumcommunications and laser applications.Their performances allow at recover of high-resolution images.","=HYPERLINK(""http://www.alpao.com"")",BERTIN ALPAO  727 Rue Aristide Bergès  Montbonnot-Saint-Martin  France  38330
8605,Boston Electronics Corp.,"=HYPERLINK(""https://spie.org/ExhibitorDetail?ExpoID=5010&ExhibitorID=101916"")","Picosecond resolution photon counting for the UV-Visible-NIR using Time Correlated Single Photon Counting (TCSPC) for applications like Fluorescence Lifetime Imaging Microscopy (FLIM), and Single Molecule Detection. Signal processing electronics, detectors, picosecond lasers and advanced imaging software from Becker & Hickl. Transient recorders from Licel.","=HYPERLINK(""http://www.boselec.com"")","Boston Electronics Corp.  91 Boylston St  Brookline, MA  United States  02445-7602"
8331,Boston Micromachines Corp.,"=HYPERLINK(""https://spie.org/ExhibitorDetail?ExpoID=5010&ExhibitorID=101330"")",No Description Found,"=HYPERLINK(""http://www.bostonmicromachines.com"")","Boston Micromachines Corp  30 Spinelli Pl Ste 103  Cambridge, MA  United States  02138-1046"
8312,Bright Solutions Srl,"=HYPERLINK(""https://spie.org/ExhibitorDetail?ExpoID=5010&ExhibitorID=102197"")","Bright Solutions develops and manufactures state-of-the-art ns, sub-ns DPSS lasers and high brightness diode laser modules. The Company’s activity is oriented towards the development of state-of-the-art diode-pumped solid-state laser systems aimed at superior, efficiency, compactness and reliability, suitable for industrial, aerospace, medical, military and scientific applications.","=HYPERLINK(""http://www.brightsolutions.it"")",Bright Solutions Srl  Via degli Artigiani 27  Cura Carpignano  Italy  27010
8434,BWTek Med,"=HYPERLINK(""https://spie.org/ExhibitorDetail?ExpoID=5010&ExhibitorID=103010"")","BWtek Medical designs and manufactures photonic-based medical devices for therapy and diagnosis under GMP/ISO13485/FDA standards. Since 1997, we’ve collaborated with top institutions to develop laser therapies, 3D bio-printers, and optical spectroscopic instruments. We support academic and start-up partners with engineering, clinical trials, FDA compliance, and commercialization.","=HYPERLINK(""http://www.bwtekmed.com"")","BWTek Med  18 Shea Way Ste 103  Newark, DE  United States  19713-3448"
8342,Calmar Laser,"=HYPERLINK(""https://spie.org/ExhibitorDetail?ExpoID=5010&ExhibitorID=101268"")",No Description Found,"=HYPERLINK(""http://www.calmarlaser.com"")","Calmar Laser  951 Commercial St  Palo Alto, CA  United States  94303-4908"
8372,Carl Zeiss Jena GmbH,"=HYPERLINK(""https://spie.org/ExhibitorDetail?ExpoID=5010&ExhibitorID=102941"")","With ZEISS OEM Solutions, you will have a reliable development partner by your side from the very beginning. We develop and manufacture optical modules and systems optimized for your requirements. All relevant optical and mechanical components are manufactured by one company. This enables products to be used in the most demanding circumstances. We consolidate knowledge, technologies and experts to ensure an efficient production process – from the first sketch right through to series production.","=HYPERLINK(""http://www-zeiss-com/oem-solutlons"")",Carl Zeiss Jena GmbH  Carl Zeiss Promenade 10  Jena  Germany  07745
8372,Carl Zeiss Microscopy GmbH,"=HYPERLINK(""https://spie.org/ExhibitorDetail?ExpoID=5010&ExhibitorID=102942"")","ZEISS OEM Microscopes and Objectives - Combine your ideas for microscopy solutions with proven quality microscopes and parts from ZEISS. Choose the perfect microscope stand, light path or objective that completes your innovative product. Whenever your ideas demand microscope components that don’t even exist yet: talk to us to discuss and define the ideal customized solution for you. Enhance your product with proven quality components and optical performance plus a strong, trusted brand.","=HYPERLINK(""http://www.zeiss-com/oem"")",Carl Zeiss Microscopy GmbH  Carl-Zeiss-Promenade 10  Jena  Germany  07745
8372,Carl Zeiss Spectroscopy GmbH,"=HYPERLINK(""https://spie.org/ExhibitorDetail?ExpoID=5010&ExhibitorID=101553"")","Focus your perspective on quality. ZEISS Optical Gratings and Spectrometer Modules. You expect precise measurement even under production conditions – our optical gratings and OEM spectrometers provide the quality and performance you need for everything you design. Regardless of whether it’s in the UV, Vis or NIR region – ZEISS has a wide range of solutions and helps turn your ideas into successful products. From off-the-shelf OEM products to customized options, we’re your partner.","=HYPERLINK(""http://www.zeiss.com/spectroscopy"")",Carl Zeiss Spectroscopy GmbH  Carl-Zeiss-Promenade 10  Jena  Germany  07745
8216,Cassio-P SA,"=HYPERLINK(""https://spie.org/ExhibitorDetail?ExpoID=5010&ExhibitorID=102884"")",No Description Found,"=HYPERLINK(""http://cassio-p.com"")",Cassio-P SA  Rue de la Maladière 71C  Neuchâtel  Switzerland  2000
8425,Chroma Technology Corp.,"=HYPERLINK(""https://spie.org/ExhibitorDetail?ExpoID=5010&ExhibitorID=102137"")",No Description Found,"=HYPERLINK(""http://www.chroma.com"")","Chroma Technology Corp  10 Imtec Ln  Bellows Falls, VT  United States  05101-3119"
8215,Class 5 Photonics GmbH,"=HYPERLINK(""https://spie.org/ExhibitorDetail?ExpoID=5010&ExhibitorID=103162"")",No Description Found,"=HYPERLINK(""http://www.class5photonics.com"")",Class 5 Photonics GmbH  Deutsches Elektronensynchrotron  Notkestr. 85  Hamburg  Germany  22607
8555,CNI Laser,"=HYPERLINK(""https://spie.org/ExhibitorDetail?ExpoID=5010&ExhibitorID=102074"")","Changchun New Industries Optoelectronics Tech. Co., Ltd. (CNI), is dedicated to offer best quality lasers, laser systems, optical spectrum analyzer, teaching and laboratory equipment, optical measuring equipment,laser processing equipment, machine vision and the photoelectric detection, etc.","=HYPERLINK(""http://www.cnilaser.com"")","CNI Laser  No 888 Jinhu Rd High-Tech Zone  Changchun, JL  China  130103"
8624,Coherent Corp.,"=HYPERLINK(""https://spie.org/ExhibitorDetail?ExpoID=5010&ExhibitorID=101528"")","Coherent produces the widest and most comprehensive range of materials, photonic components, lasers, laser-based subsystems, and turnkey tools for scientific, commercial, and industrial applications. The Coherent philosophy is simple – to deliver innovative products offering superior performance and reliability, backed by a worldwide support infrastructure, thus empowering our customers to take maximum advantage of the unique benefits of photonics technology.","=HYPERLINK(""http://www.coherent.com"")","Coherent Corp.  5100 Patrick Henry Dr  Santa Clara, CA  United States  95054-1112"
8208,CoolLED,"=HYPERLINK(""https://spie.org/ExhibitorDetail?ExpoID=5010&ExhibitorID=103015"")","CoolLED’s OEM technology is centred on the Amora Series: our proven off-the-shelf product range adapted to offer unparalleled customisation opportunities. This provides you with an efficient and low-risk solution, while also addressing the specific needs of your application.","=HYPERLINK(""http://coolled.com"")",CoolLED  26 Focus Way  Andover  United Kingdom  SP10 5NY
8240,Corning Varioptic,"=HYPERLINK(""https://spie.org/ExhibitorDetail?ExpoID=5010&ExhibitorID=102464"")","Corning® Varioptic® Lenses are optical devices that adjust voltage to change the shape ofa liquid interface. Corning's unique technology addresses demanding markets for industrial imaging applications offering a solution: the electrowetting principle where the interface of two liquids is modified when a voltage is applied. When combined with two types of fluids (oil and electrolyte), three different types of lenses can be varied eliminating moving parts and enabling fast focus.","=HYPERLINK(""http://www.corning.com"")","Corning Varioptic  Corning Varioptic Lenses  1 Riverfront Plz  Corning, NY  United States  14831-0001"
8667,Cubert GmbH,"=HYPERLINK(""https://spie.org/ExhibitorDetail?ExpoID=5010&ExhibitorID=101959"")",No Description Found,"=HYPERLINK(""http://www.cubert-hyperspectral.com"")",Cubert GmbH  Science Park II  Lise-Meitner-Str. 8/1  Ulm  Germany  89081
8665,Cutting Edge Optronics,"=HYPERLINK(""https://spie.org/ExhibitorDetail?ExpoID=5010&ExhibitorID=102183"")","Cutting Edge Optronics (CEO), a subsidiary of Northrop Grumman, is a leading manufacturer of laser diodes, DPSS laser modules and complete DPSS laser systems. CEO products and systems are used in medical applications including dermatology, hair removal, lithotripsy and dentistry.","=HYPERLINK(""http://www.cuttingedgeoptronics.com"")","Cutting Edge Optronics  20 Point West Blvd  Saint Charles, MO  United States  63301-4430"
8476,"Cyberdyne, Inc.","=HYPERLINK(""https://spie.org/ExhibitorDetail?ExpoID=5010&ExhibitorID=102678"")","CYBERDYNE, INC. is a Japanese technology company, best known for its Hybrid Assistive Limb(HAL) systems, which are the world’s first cyborg-type robots. HAL is controlled by “bio-electrical signals” that appear on the surface of the skin that reflect motion intent. Apart from multiple variants of HAL, CYBERDYNE also develops medical diagnostic devices and has recently been focusing on the development and clinical translation of its proprietary LED-based photoacoustic imaging technology.","=HYPERLINK(""http://www.cyberdyne.jp/english"")","Cyberdyne, Inc.  2-2-1 Gakuenminami  Tsukuba-Shi  Japan  305-0818"
8353,DataRay Inc.,"=HYPERLINK(""https://spie.org/ExhibitorDetail?ExpoID=5010&ExhibitorID=101240"")","DataRay Inc. was founded in 1988 to bring affordable, high-performance beam profiling to the photonics community. DataRay manufactures precision, UV to 16 μm beam profiling instruments for laser, laser assembly and fiber optic telecom beam profiling and imaging to ISO 11146 standards.","=HYPERLINK(""http://dataray.com"")","DataRay Inc.  Ste 1  31 Upper Ragsdale Dr  Monterey, CA  United States  93940"
8424,Edmund Optics Inc.,"=HYPERLINK(""https://spie.org/ExhibitorDetail?ExpoID=5010&ExhibitorID=102274"")","Edmund Optics has been a leading producer of optics, imaging, and laser optics for 80 years. Discover the latest optical and imaging technology.","=HYPERLINK(""http://www.edmundoptics.com"")","Edmund Optics Inc.  101 E Gloucester Pike  Barrington, NJ  United States  08007-1380"
8553,EKSPLA,"=HYPERLINK(""https://spie.org/ExhibitorDetail?ExpoID=5010&ExhibitorID=102262"")","Innovative manufacturer of lasers & electronics from ultrafast industrial to unique custom system for basic research. In-house R&D team and more than 30 years’ experience enable to tailor products for specific applications and/or according to specific requirements. Main products are: femtosecond, picosecond and nanosecond lasers, tunable wavelength systems, ultrafast fiber lasers, spectroscopy systems and laser electronics.","=HYPERLINK(""http://ekspla.com"")",EKSPLA  Savanoriu Ave 237  Vilnius  Lithuania  LT-02300
8428,Electro Optics Magazine,"=HYPERLINK(""https://spie.org/ExhibitorDetail?ExpoID=5010&ExhibitorID=103139"")",No Description Found,"=HYPERLINK(""http://www.electrooptics.com"")",Electro Optics Magazine  4 Signet Ct  Cambridge  United Kingdom  CB5 8LA
