Booth Number(s),Company Name,Link to Company,Description,Website link,Company Contact Information
8411,"Energetiq Technology, Inc.","=HYPERLINK(""https://spie.org/ExhibitorDetail?ExpoID=5010&ExhibitorID=103505"")","Energetiq designs, develops, and manufactures ultra-bright broadband light sources for complex scientific and engineering applications, including semiconductor manufacturing and life sciences analytical instruments. Our light sources generate high brightness across the spectrum, from soft x-ray to infrared and beyond. Energetiq focuses on rapid development and on-time delivery of reliable, long-lasting products for volume production applications. Energetiq is a subsidiary of Hamamatsu Photonics.","=HYPERLINK(""http://www.energetiq.com"")","Energetiq Technology, Inc.  205 Lowell St Ste 1A  Wilmington, MA  United States  01887-2972"
8222,EPIGAP OSA Photonics GmbH,"=HYPERLINK(""https://spie.org/ExhibitorDetail?ExpoID=5010&ExhibitorID=102821"")","EPIGAP OSA Photonics GmbH produces and distributes LED chips, SMD & THT LEDs, photodiodes, as well as CoB modules in the wavelength range of 230 nm to 2300 nm for energy-efficient, smart, and future-proof products in the fields of industrial sensor technology, security technology, and medical technology.","=HYPERLINK(""http://www.epigap-osa.de"")",EPIGAP OSA Photonics GmbH  Köpenicker Str. 325  Berlin  Germany  12555
8538,"Etaluma, Inc.","=HYPERLINK(""https://spie.org/ExhibitorDetail?ExpoID=5010&ExhibitorID=102808"")","Etaluma is a privately-held bioimaging technology company founded in 2009 and headquartered in San Diego, CA offering next-generation imaging ecosystem with compact optical imaging technology offering multi-channel fluorescence, solid state design with small form factor for high resolution, high-photonic efficiency for maximum sensitivity, camera compatibility, and flexible motion control.","=HYPERLINK(""http://etaluma.com"")","Etaluma, Inc.  4360 Viewridge Ave Ste B  San Diego, CA  United States  92123-1679"
8324,EXALOS AG,"=HYPERLINK(""https://spie.org/ExhibitorDetail?ExpoID=5010&ExhibitorID=101547"")","Founded in 2003, EXALOS, an indie Semiconductor company (Nasdaq: INDI), is a Swiss-based technology driven company, which focuses on the design, development, manufacturing and sales of advanced light source solutions based on Superluminescent Light Emitting Diodes (Visible and Near-IR) and Visible Laser Diodes. EXALOS’s product portfolio includes driver electronics and balanced receivers which are complementary to our light source offerings. EXALOS has shipped more than 800,000 SLEDs to date.","=HYPERLINK(""http://www.exalos.com"")",EXALOS AG  Wagistrasse 21  Schlieren  Switzerland  8952
8530,Excelitas,"=HYPERLINK(""https://spie.org/ExhibitorDetail?ExpoID=5010&ExhibitorID=102187"")","Excelitas is the leading provider of advanced, life-enriching technologies that make a difference, serving global market leaders in the Life Sciences, Advanced Industrial, next-generation Semiconductor, Aerospace and Defense end-markets. Excelitas is an essential partner in the design, development, and manufacture of photonic technologies, offering leading-edge innovation in sensing, detection, imaging, optics, and specialty illumination for customers worldwide.","=HYPERLINK(""http://www.excelitas.com"")","Excelitas  2545 Railroad Street, Suite 300  Pittsburgh, PA  United States  15222"
8359,Exosens S.A.S.,"=HYPERLINK(""https://spie.org/ExhibitorDetail?ExpoID=5010&ExhibitorID=102728"")","EXOSENS is a high-tech company, with more than 85 years of experience in the innovation, development, manufacture and sale of technologies in the field of particles and photo detection and imaging. Today, it offers its customers detectors and detection solutions: its travelling wave tubes, advanced cameras, neutron & gamma detectors, instrument detectors and light intensifier tubes allow EXOSENS to respond to complex issues in environments extremely demanding by offering tailor-made solutions.","=HYPERLINK(""http://www.exosens.com"")",Exosens S.A.S.  18 Avenue Pythagore  Merignac  France  33700
8462,Feinwerkoptik Zünd AG,"=HYPERLINK(""https://spie.org/ExhibitorDetail?ExpoID=5010&ExhibitorID=102218"")","Feinwerkoptik Zünd develops imaging and non- imaging photonic systems and produces miniaturized optical components and optoelectromechanical systems. Our optic design capabilities for stereoscopic viewing are highly sophisticated as well as our production know-how for miniaturized lenses with diameter bigger than 0.5mm. The products we create are mainly used in medical, biomedical and technical solutions.","=HYPERLINK(""http://www.feinwerkoptik-zuend.ch"")",Feinwerkoptik Zünd AG  Haldenstr 3  Werdenberg  Switzerland  9470
8226,Femtika UAB,"=HYPERLINK(""https://spie.org/ExhibitorDetail?ExpoID=5010&ExhibitorID=101615"")","FEMTIKA, founded in 2013, is a leading provider of advanced laser microfabrication solutions in multiphoton polymerization and selective laser etching. The cutting-edge technology allows precise and efficient processing in a wide range of industries, including microelectronics, medical devices, and aerospace engineering. Our state-of-the-art facility is equipped with the latest equipment and technology, allowing us to provide our clients with the highest level of service and support.","=HYPERLINK(""http://www.femtika.com"")",Femtika UAB  Keramikų g. 2  Vilnius  Lithuania  10233
8453,FEMTOprint SA,"=HYPERLINK(""https://spie.org/ExhibitorDetail?ExpoID=5010&ExhibitorID=101323"")","FEMTOprint is a Swiss high-tech, Contract Development and Manufacturing Organization specialized in high-precision, 3D printing in glass. With the proprietary laser-based FEMTOPRINT® microfabrication platform, we offer truly free-form surface/volume definition, welding, ablative, and surface treatment solutions in glass, thus, creating advanced, highly precise, and functionalized microdevices in micro-optical, microfluidic, microelectronic, and micromechanical applications.","=HYPERLINK(""http://www.femtoprint.ch"")",FEMTOprint SA  Via Campagna 16  Agno  Switzerland  6982
8418,Fibertech Optica Inc.,"=HYPERLINK(""https://spie.org/ExhibitorDetail?ExpoID=5010&ExhibitorID=101704"")","A leader in the design and manufacture of integrated specialty fiber optic solutions, FTO offers precision micro optical assemblies, bundles, v-groove arrays, Raman & reflectance probes, high power laser cables and vacuum feedthrough for use from Deep UV to MIR wavelengths. FTO also offers multi-wavelength fiber-coupled LED illumination and calibration light sources to generate arbitrary spectral output profiles. Our light sources can support up to 18 channels.","=HYPERLINK(""http://www.fibertech-optica.com"")","Fibertech Optica Inc.  330 Gage Ave Suite 1  Kitchener, ON  Canada  N2M 5C6"
8636,Flash Pathology B.V.,"=HYPERLINK(""https://spie.org/ExhibitorDetail?ExpoID=5010&ExhibitorID=103370"")",No Description Found,"=HYPERLINK(""http://flashpathology.com"")",Flash Pathology B.V.  De Boelelaan 1085  Amsterdam  Netherlands  1081 HV
8675,"Fujian Dayoptics, Inc.","=HYPERLINK(""https://spie.org/ExhibitorDetail?ExpoID=5010&ExhibitorID=103292"")",No Description Found,"=HYPERLINK(""http://www.dayoptics.com"")","Fujian Dayoptics, Inc.  Bldg 6  No 66 Anxia Rd  Fuzhou, FJ  China  350109"
8533,G&H Group,"=HYPERLINK(""https://spie.org/ExhibitorDetail?ExpoID=5010&ExhibitorID=102185"")","For seven decades, G&H’s innovative approach to optical component design has been key in advancing the performance and reliability of life science instrumentation for medical microscopy, diagnostic imaging, and laser surgery. We are recognized as a leading provider for photonics in life sciences with our advanced glass and polymer optics, fiber optics, acousto-optics and Pockels cells, targeting medical research, diagnostic imaging, and laser surgery applications worldwide.","=HYPERLINK(""http://gandh.com"")",G&H Group  Dowlish Ford  Ilminster  United Kingdom  TA19 0PF
8659,GF Technology Sdn. Bhd.,"=HYPERLINK(""https://spie.org/ExhibitorDetail?ExpoID=5010&ExhibitorID=102600"")","We are coating house located in Penang, Malaysia specialized in Optical Filter with high optical density requirement for fluorescent application, sensor such as SI detector, InGaAs detector, TOF, Raman Spectroscopy application. Our product in filters inclusive of Bandpass, Short Wave Pass, Long Wave Pass, Notch Filters and Dichroic Filters. We also produce high reflective protected, unprotected mirrors, Silver mirror, Multi layer Dielectric Mirror. AR and BS for automotive, XR industry-AR,MR,VR","=HYPERLINK(""http://www.gf-technology.com"")",GF Technology Sdn. Bhd.  Kawasan Perindustrian 4 Mukim 12 Daerah Barat Daya  Plot 108 Hilir Sungai Keluang 5  Bayan Lepas  Malaysia  11900
8575,"Greenlight Optics, LLC","=HYPERLINK(""https://spie.org/ExhibitorDetail?ExpoID=5010&ExhibitorID=103453"")","Greenlight Optics is a leading optical product development and ISO9001 optics manufacturing company specializing in projection and AR/VR, imaging and sensing systems, LED and laser illumination, and plastic optics. With in-house optical and mechanical design, diamond turning, glass lens manufacturing, CNC machining, plastic optics molding, metrology, and advanced assembly and testing capabilities, Greenlight Optics quickly turns ideas into prototypes and manufactured products.","=HYPERLINK(""http://www.greenlightoptics.com"")","Greenlight Optics, LLC  8940 Glendale Milford Rd  Loveland, OH  United States  45140-8908"
8662,Grintech GmbH,"=HYPERLINK(""https://spie.org/ExhibitorDetail?ExpoID=5010&ExhibitorID=101851"")","GRINTECH manufactures gradient index (GRIN) lenses and lens systems for applications in sensor technology, fiber optics, bio photonics medical imaging, telecommunication and laser diode beam shaping tailored to your specific requirements. Rod and cylindrical lenses are fabricated by unique non-toxic silver ion-exchange technique in glas. Contact: Herbert Stuermer, info@grintech.de","=HYPERLINK(""http://www.grintech.de"")",Grintech GmbH  Otto-Eppenstein-Str. 7  Jena  Germany  07745
8411,Hamamatsu Corp.,"=HYPERLINK(""https://spie.org/ExhibitorDetail?ExpoID=5010&ExhibitorID=102129"")",No Description Found,"=HYPERLINK(""http://www.hamamatsu.com"")","Hamamatsu Corp.  360 Foothill Rd  Bridgewater, NJ  United States  08807-2920"
8472,Heliotis AG,"=HYPERLINK(""https://spie.org/ExhibitorDetail?ExpoID=5010&ExhibitorID=102092"")",No Description Found,"=HYPERLINK(""http://www.heliotis.com"")",Heliotis AG  Längenbold 5  Root  Switzerland  6037
8603,HighFinesse GmbH,"=HYPERLINK(""https://spie.org/ExhibitorDetail?ExpoID=5010&ExhibitorID=102741"")","HighFinesse GmbH is a leading global manufacturer in the field of optical measurement technology, headquartered in Tübingen, Germany. We offer innovative, high-precision devices for the photonics industry, telecommunications and scientific research. Our portfolio includes wavelength meters, linewidth analyzers, spectrometers and calibration sources. The WS8 is recognized as the most accurate commercially available wavelength meter and serves as the ultimate tool for laser characterization.","=HYPERLINK(""http://www.highfinesse.com"")",HighFinesse GmbH  Laser and Electronic Systems  Neckarsulmer Strasse 5  Tübingen  Germany  72072
8552,HOLOEYE Photonics AG,"=HYPERLINK(""https://spie.org/ExhibitorDetail?ExpoID=5010&ExhibitorID=101383"")","HOLOEYE supplies products and services in the fields of Spatial Light Modulators, a broad range of standard Diffractive Optical Elements as well as customized design and fabrication services for Diffractive Optics and LCOS microdisplay components. HOLOEYE offers highly specialized, most flexible and diversified standard solutions for academic and industrial R&D and provides the highest level of component customization, custom developments, and volume production for industrial integration.","=HYPERLINK(""http://holoeye.com"")",HOLOEYE Photonics AG  Volmerstr. 1  Berlin  Germany  12489
8461,HUBNER Photonics,"=HYPERLINK(""https://spie.org/ExhibitorDetail?ExpoID=5010&ExhibitorID=101897"")","HÜBNER Photonics offers the full range of high performance Cobolt lasers, C-WAVE cw tunable lasers, VALO femtosecond lasers along with a full selection of C-FLEX laser combiners. HÜBNER Photonics Inc. has become a preferred supplier of lasers to major instrument manufacturers and leading research labs for cutting-edge applications in the areas of fluorescence microscopy, multiphoton microscopy, flow cytometry, Raman spectroscopy, metrology, holography, nanophotonic and quantum research.","=HYPERLINK(""http://hubner-photonics.com"")","HUBNER Photonics  2635 N 1st St Ste 228  San Jose, CA  United States  95134-2044"
8656,"HySpex, Norsk Elektro Optikk AS","=HYPERLINK(""https://spie.org/ExhibitorDetail?ExpoID=5010&ExhibitorID=102730"")",No Description Found,"=HYPERLINK(""http://www.hyspex.com"")",HySpex  Østensjøveien 34  Oslo  Norway  0667
8540,Ibsen Photonics A/S,"=HYPERLINK(""https://spie.org/ExhibitorDetail?ExpoID=5010&ExhibitorID=102268"")","Ibsen Photonics provides leading industrial companies with best-in-class gratings and spectrometers. Our compact, high-performance spectrometers boast minimal unit-to-unit performance variation and robust environmental stability, leading to reduced implementation costs and eliminating the need for field calibration and re-calibration. We serve as a strong long-term strategic partner for industrial companies, delivering customized solutions tailored to their specific needs.","=HYPERLINK(""http://www.ibsen.com"")",Ibsen Photonics A/S  Ryttermarken 17  Farum  Denmark  3520
8204,Imagine Optic SA,"=HYPERLINK(""https://spie.org/ExhibitorDetail?ExpoID=5010&ExhibitorID=102477"")",No Description Found,"=HYPERLINK(""http://www.imagine-optic.com"")",Imagine Optic SA  18 rue Charles de Gaulle  Orsay  France  91400
8467,IMT Precision on Glass,"=HYPERLINK(""https://spie.org/ExhibitorDetail?ExpoID=5010&ExhibitorID=101432"")","IMT comprises profound knowledge in microtechnology and offers foundry services for all kinds of microstructures on respectively in glass. Standard semiconductor technology enables us to provide our customers with state of the art microfluidic chips such as, flow cells, impedance chips, MEAS, µ-TAS and electrically conductive structures, where glass is first choice!","=HYPERLINK(""http://www.imtag.ch"")",IMT Precision on Glass  Im Langacher 46  Greifensee  Switzerland  8606
8657,InfraTec Infrared LLC,"=HYPERLINK(""https://spie.org/ExhibitorDetail?ExpoID=5010&ExhibitorID=101921"")","InfraTec, founded in 1991 and with its own design, manufacturing and distribution capabilities, is headquartered in Dresden, Germany. Its infrared measurement business unit is one of the leading suppliers of commercial thermal imaging technology including not only infrared cameras but also turnkey thermography automation solutions for numerous applications. The infrared sensor division produces customized components – esp. pyroelectrical infrared detectors.","=HYPERLINK(""http://www.InfraTec-Infrared.com"")","InfraTec Infrared LLC  1900 West Loop South, Suite 1550  Houston, TX  United States  77027"
8224,INO,"=HYPERLINK(""https://spie.org/ExhibitorDetail?ExpoID=5010&ExhibitorID=102690"")","ISO 13485 certified, INO applies optics, photonics & vision-based innovations to create advanced medical devices, critical components of scientific instruments or optical sensors used in biological processes. INO provides engineering & design services from proof of concept, through prototyping, up to short run series commercial production, supported by INO’s industrialisation team. INO also works in collaboration with research centers, biotech & pharmaceutical companies to develop technolog","=HYPERLINK(""http://www.ino.ca"")","INO  2740 Einstein Rue  Quebec, QC  Canada  G1P 4S4"
8378,"Iradion Laser, Inc.","=HYPERLINK(""https://spie.org/ExhibitorDetail?ExpoID=5010&ExhibitorID=102134"")","Iradion Laser, Inc. Uxbridge, MA, USA, produces the patented CERAMICORE® CO2 lasers. Power levels from 25 to 250 watt with wavelengths of 10.6, 10.2 or 9.3 microns. Benefits include: fast rise/fall times, compact size, superior power stability from 2% to maximum power, and unmatched longevity which exceeds conventional glass and metal tube CO2 lasers. Iradion also offers NANOCORE and FEMTOCORE lasers with superior performance for micro applications. Customized DPSS laser solutions are available.","=HYPERLINK(""http://www.iradionlaser.com"")","Iradion Laser, Inc.  1 Technology Dr  Uxbridge, MA  United States  01569-2282"
8539,Iridian Spectral Technologies Ltd.,"=HYPERLINK(""https://spie.org/ExhibitorDetail?ExpoID=5010&ExhibitorID=102203"")",No Description Found,"=HYPERLINK(""http://www.iridian.ca"")","Iridian Spectral Technologies Ltd  2700 Swansea Cres  Ottawa, ON  Canada  K1G 6R8"
8220,Irisiome Solutions,"=HYPERLINK(""https://spie.org/ExhibitorDetail?ExpoID=5010&ExhibitorID=102932"")",No Description Found,"=HYPERLINK(""http://www.irisiome-solutions.com"")",Irisiome Solutions  Cité de la Photonique  11 Ave de Canteranne  Pessac  France  33600
8318,"ISS, Inc.","=HYPERLINK(""https://spie.org/ExhibitorDetail?ExpoID=5010&ExhibitorID=102110"")","ISS offers spectrofluorometers, time-resolved laser scanning confocal microscopes, FLIM/FCS upgrade kits for commercial confocal microscopes and NIRS biomedical instrumentation for the measurements of oxygen saturation and blood flow in brain and muscle tissue. For the researcher willing to custom-build an instrument, a variety of modular components (laser diodes, lasers launchers, detectors, data acquisition cards, control cards) complements the instrumentation.","=HYPERLINK(""http://www.iss.com"")","ISS, Inc.  1602 Newton Dr  Champaign, IL  United States  61822-1061"
8317,"Isuzu Glass, Inc.","=HYPERLINK(""https://spie.org/ExhibitorDetail?ExpoID=5010&ExhibitorID=101299"")","Isuzu Glass offers a line of optical filters with a variety of spectral characteristics for applications in opto-electronics, office automation equipment, photography, lighting, and medical equipment. Every glass filter has its own spectral characteristics and is manufactured under the strict quality control procedures providing a minimum of bubbles and striae. Physically and chemically stable, the glass is not susceptible to the problems of aging.","=HYPERLINK(""http://www.isuzuglass.com"")","Isuzu Glass, Inc.  23505 Crenshaw Blvd Ste 130  Torrance, CA  United States  90505-5225"
8561,"J.A. Woollam Co., Inc.","=HYPERLINK(""https://spie.org/ExhibitorDetail?ExpoID=5010&ExhibitorID=101446"")",No Description Found,"=HYPERLINK(""http://www.jawoollam.com"")","J. A. Woollam Co Inc  311 S 7th St  Lincoln, NE  United States  68508-2274"
8643,lambda glass solutions GmbH & Co. KG,"=HYPERLINK(""https://spie.org/ExhibitorDetail?ExpoID=5010&ExhibitorID=102591"")",We are a part of a family owned complex of world leadingsuppliers of Quartz Glass components.Lambda glass solutions realizes super high precise fused silica3D parts with micrometer details and accuracy.,"=HYPERLINK(""http://www.lambda-glass.de"")",lambda glass solutions GmbH & Co. KG  Tempelweg 12  Burgwedel  Germany  30938
8376,LAMBDA-X High-Tech,"=HYPERLINK(""https://spie.org/ExhibitorDetail?ExpoID=5010&ExhibitorID=102240"")","From initial concept development to the mass production of optimized products, we’re here to support you at every stage. Our services include Conceptual and Feasibility Studies, Design and Engineering, Demonstrators and Prototypes, Industrialization, and OEM Manufacturing. Each service is tailored to meet the intricate needs of your projects, accompanying you from concept to reality.","=HYPERLINK(""http://hightech.lambda-x.com"")",LAMBDA-X High-Tech  Avenue Robert Schuman 102  Nivelles  Belgium  1400
8658,Laser Focus World,"=HYPERLINK(""https://spie.org/ExhibitorDetail?ExpoID=5010&ExhibitorID=102286"")","Laser Focus World provides the insights and information about photonics-related products and services, its global audience of engineering and research professionals needs to solve their biggest challenges.","=HYPERLINK(""http://www.laserfocusworld.com"")","Laser Focus World  Endeavor Business Media Technology Group  61 Spit Brook Rd Ste 401  Nashua, NH  United States  03060-5614"
8454,LD-PD Inc.,"=HYPERLINK(""https://spie.org/ExhibitorDetail?ExpoID=5010&ExhibitorID=102076"")","LD-PD INC. was established in 2004 ,with its headquarter located in Singapore.LD-PD has been mainly engaged in related laser driver products such as photodetectors and laser diodes.Over the years, we have devoted ourselves to research and have become one of the leading suppliers of photodetectors, laser diodes and related driving products.The core concept of LD-PD is to design and manufacture high power and high reliability products for every customer.","=HYPERLINK(""http://www.ld-pd.com/?"")",LD-PD Inc.  288 Woodlands Loop #04-00  Singapore  Singapore  738100
8306,Leonardo DRS,"=HYPERLINK(""https://spie.org/ExhibitorDetail?ExpoID=5010&ExhibitorID=101373"")","DRS Daylight Solutions, a line of business under Leonardo DRS, provides photonics solutions to researchers, industry allies, and system manufacturers. Daylight specializes in manufacturing high-performance lasers across the spectrum from UV to IR, offering capabilities in broad tuning, narrow linewidth, and high power. The company’s core technologies include a family of quantum cascade lasers (QCL-IR), external cavity diode lasers (EC-DLs), and custom laser engines.","=HYPERLINK(""http://daylightsolutions.com"")","Leonardo DRS  DRS Daylight Solutions  16465 Via Esprillo  San Diego, CA  United States  92127-1701"
8236,LEUKOS,"=HYPERLINK(""https://spie.org/ExhibitorDetail?ExpoID=5010&ExhibitorID=102605"")",No Description Found,"=HYPERLINK(""http://www.leukos-laser.com"")","LEUKOS  Beaublanc , 2 Rue Edouard Michaud  Limoges  France  87100"
8630,"Light Conversion, UAB","=HYPERLINK(""https://spie.org/ExhibitorDetail?ExpoID=5010&ExhibitorID=102263"")","LIGHT CONVERSION designs and manufactures femtosecond solutions for industry and science. It includes microscopy-dedicated femtosecond laser sources CRONUS, that cover applications in functional neuroimaging, optogenetics, and deep imaging using medium-repetition-rate three-photon (3P) excitation and fast high-repetition-rate two-photon (2P) imaging, widefield and holographic excitation. The CRONUS series features robust design, automated GDD control, and market-leading output stability.","=HYPERLINK(""http://lightcon.com"")","Light Conversion, UAB  Keramikų g. 2B  Vilnius  Lithuania  10233"
8652,Liquid Instruments,"=HYPERLINK(""https://spie.org/ExhibitorDetail?ExpoID=5010&ExhibitorID=102048"")",No Description Found,"=HYPERLINK(""http://www.liquidinstruments.com"")","Liquid Instruments  12526 High Bluff Dr Ste 150  San Diego, CA  United States  92130-3044"
8647,Litron Lasers Ltd.,"=HYPERLINK(""https://spie.org/ExhibitorDetail?ExpoID=5010&ExhibitorID=101943"")","Specialists in the design and manufacture of pulsed Nd:YAG lasers, PIV Nd:YAG lasers, DPSS Nd:YAG, CW Nd:YLF lasers and true TEM00 lasers. Litron Lasers has enjoyed continued growth and development since our inception in 1997 and now more than 25 years later we sit firmly at the forefront of solid state laser technology with an install base of many thousands of lasers spanning the globe.","=HYPERLINK(""http://www.litronlasers.com"")",Litron Lasers Ltd.  8 Consul Road  Rugby  United Kingdom  CV21 1PB
8655,LouwersHanique,"=HYPERLINK(""https://spie.org/ExhibitorDetail?ExpoID=5010&ExhibitorID=101724"")","LouwersHanique specializes in laser assisted micromachining (SLE) and thermal forming of quartz, borosilicate and technical ceramics (such as aluminum oxide, silicon carbide, silicon, and Macor). The company activities also include the bonding and [clean room] assembly of unique material combinations based on an extensive range of bonding and integration technologies. We manufacture precision parts as mixers, microfluidics, optical fiber parts from prototypes to volume in (sub)micron precision.","=HYPERLINK(""http://www.louwershanique.com"")",LouwersHanique  Energieweg 3 A  Hapert  Netherlands  5527 AH
8470,"Lumedica, Inc.","=HYPERLINK(""https://spie.org/ExhibitorDetail?ExpoID=5010&ExhibitorID=102883"")",No Description Found,"=HYPERLINK(""http://www.lumedica.com"")","Lumedica Inc  404 Hunt St Ste 510  Durham, NC  United States  27701-2275"
8371,LUMIBIRD,"=HYPERLINK(""https://spie.org/ExhibitorDetail?ExpoID=5010&ExhibitorID=101681"")","LUMIBIRD is one of the world's leading specialists in lasers. With over 50 years of experience and expertise in solid-state lasers, laser diodes and fiber laser technologies, the group (formerly KEOPSYS-QUANTEL) designs, manufactures and markets high performance lasers for scientific (laboratories and universities), industrial (manufacturing, defense, lidar sensors) and medical. The Group is present on several continents through its 13 production and R&D sites, and employs over 1,000 people.","=HYPERLINK(""http://www.lumibird.com/en"")","LUMIBIRD  49 Willow Peak Dr  Bozeman, MT  United States  59718-9811"
8378,Luxinar Inc.,"=HYPERLINK(""https://spie.org/ExhibitorDetail?ExpoID=5010&ExhibitorID=103554"")","Luxinar, a leader in laser technology, boasts 25+ years in CO₂ lasers up to 1000W and ultrashort pulse laser expertise. Headquartered in the UK, Luxinar has sales/service hubs in Asia, Europe, and North America, with thousands of global installations. Now partnered with Iradion Laser Sources, we provide a wider choice of laser sources, applications and international support across three continents. Our CO₂ laser range extends from 30 to 1000W and we offer a combined short pulse laser portfolio.","=HYPERLINK(""http://www.luxinar.com"")","Luxinar Inc.  51047 Celeste  Shelby Township, MI  United States  48315-2921"
