Booth Number(s),Company Name,Link to Company,Description,Website link,Company Contact Information
1259,Lumics GmbH,"=HYPERLINK(""https://spie.org/ExhibitorDetail?ExpoID=5008&ExhibitorID=101830"")","Lumics designs and manufactures high power multi & single mode diode laser modules from 670nm up to 1940nm. In-house capabilities range from own chip fab to fiber-coupled modules & solutions with driver boards and cooling. Our multi-emitter modules offer an unmatched choice of wavelengths, sensors + signals with powers from 1W to >800W ex fiber. Multiple wavelengths in one module possible. Single mode BTF modules with exceptional life time, up to 500mW cw, FBG for short ns pulsing, PM fiber.","=HYPERLINK(""http://www.lumics.com"")",Lumics GmbH  Schwarze-Pumpe-Weg 16  Berlin  Germany  12681
2549,LUMIDAR TECHNOLOGY CO. LTD,"=HYPERLINK(""https://spie.org/ExhibitorDetail?ExpoID=5008&ExhibitorID=103345"")","LUMIDAR is a company focus on developing the next generation of Vis-SWIR CMOS image sensors, with applications in machine vision, autonomous driving, and smart consumer electronics. With our patented organic semiconductor technology, we achieved direct integration of solution-processed wide-spectrum organic photodiodes onto CMOS ROICs, significantly reducing the manufacturing cost of SWIR image sensors and accelerating the development of next-generation active imaging systems.","=HYPERLINK(""http://www.lumidartech.com"")","LUMIDAR TECHNOLOGY CO. LTD  H6-601  NO.39 Ruihe Road, Huangpu District  Guangzhou, GD  China  510530"
1933,"Lumina Power, Inc.","=HYPERLINK(""https://spie.org/ExhibitorDetail?ExpoID=5008&ExhibitorID=101426"")",No Description Found,"=HYPERLINK(""http://www.luminapower.com"")","Lumina Power Inc  26 Ward Hill Ave  Bradford, MA  United States  01835-6929"
4109,Luminar Semiconductor Inc.,"=HYPERLINK(""https://spie.org/ExhibitorDetail?ExpoID=5008&ExhibitorID=103499"")","Luminar Semiconductor Inc (LSI) is comprised of Black Forest Engineering, EM4, Freedom Photonics, and Optogration, all key suppliers of integral photonic components for a variety of applications and markets. These companies are experts in ROICs, laser sources, photonic integration, packaging, photodetectors & arrays and this combination enables LSI to provide solutions at the integration level required by our customers, from chips and arrays on up to components and subsystems.","=HYPERLINK(""http://www.freedomphotonics.com"")","Luminar Semiconductor Inc.  2603 Discovery Dr Ste 100  Orlando, FL  United States  32826-3006"
154,Luminate,"=HYPERLINK(""https://spie.org/ExhibitorDetail?ExpoID=5008&ExhibitorID=101873"")","Luminate, the world’s largest startup accelerator for businesses with optics, photonics, and imaging-enabled technology, is part of the NextCorps family, based in Rochester, NY, the imaging capital of the world. The 6-month intensive accelerator program provides immediate funding plus comprehensive training, mentors, access to benchmark resources, and follow-on investment to help startups scale their businesses.","=HYPERLINK(""http://luminate.org"")","Luminate  Luminate  260 E Main St Ste 6000  Rochester, NY  United States  14604-2100"
1957,Luminit Inc.,"=HYPERLINK(""https://spie.org/ExhibitorDetail?ExpoID=5008&ExhibitorID=101350"")","Luminit's expertise in holography and photonics, combined with a patented mastering and manufacturing process, developed and scaled our first product, Light Shaping Diffusers®, the highest selling, high performance diffuser on the market. Luminit diffusers are the gold standard for homogenizing and shaping light sources in a wide array of applications including displays, general lighting, entertainment lighting, machine vision, 3D sensing and light based medical devices.","=HYPERLINK(""http://www.luminitco.com"")","Luminit Inc.  1850 W 205th St  Torrance, CA  United States  90501-1526"
2043,"Luminus, Inc.","=HYPERLINK(""https://spie.org/ExhibitorDetail?ExpoID=5008&ExhibitorID=101574"")",No Description Found,"=HYPERLINK(""http://www.luminus.com"")","Luminus Inc  1145 Sonora Ct  Sunnyvale, CA  United States  94086-5384"
2066,LumIR Lasers,"=HYPERLINK(""https://spie.org/ExhibitorDetail?ExpoID=5008&ExhibitorID=103304"")",No Description Found,"=HYPERLINK(""http://lumirlasers.com"")","LumIR Lasers  2nd Fl  Boul du Parc Technologique 1405  Quebec, QC  Canada  G1P 4P5"
4102,Lumotive,"=HYPERLINK(""https://spie.org/ExhibitorDetail?ExpoID=5008&ExhibitorID=103141"")",No Description Found,"=HYPERLINK(""http://www.lumotive.com"")","Lumotive  4104 148th Ave NE  Redmond, WA  United States  98052-5164"
5435,Luna Innovations Inc.,"=HYPERLINK(""https://spie.org/ExhibitorDetail?ExpoID=5008&ExhibitorID=102153"")",No Description Found,"=HYPERLINK(""http://www.lunainc.com"")","Luna Innovations Inc  3155 State St  Blacksburg, VA  United States  24060-6604"
2527,"Luoyang Dingming Optical Technology Co., Ltd.","=HYPERLINK(""https://spie.org/ExhibitorDetail?ExpoID=5008&ExhibitorID=102357"")","Luoyang Dingming Optical Technology Co.,Ltd is providing optoelectronics and semiconductor substrate products since 2012. we are greatly expanding our exporting sales in optical element, laser lens, high-accuracy large-caliber optical element. Nowadays, we provide all kinds of materials, such as Si, ZnSe, ZnS, CaF2, BaF2, MgF2, GaAs, Quratz glass, Sapphire, YAG Crystal, Optical glass and other infrared optical materials.","=HYPERLINK(""http://www.dm-optical.cn"")","Luoyang Dingming Optical Technology Co., Ltd.  Luoyang Xigong Industrial Park  South of Second Daobei Road  Luoyang, HA  China  471000"
2136,"Luvantix ADM Co., Ltd.","=HYPERLINK(""https://spie.org/ExhibitorDetail?ExpoID=5008&ExhibitorID=103107"")","Luvantix ADM, with over 30 years of experience in Low Refractive Index and UV curing, offers innovative material solutions for high-tech industries that rely on photonic engineering. Our products support applications like fiber lasers, special optical fibers, photonic integrated circuits, flexible displays, optical sensors, and bio-analyses. We provide controlled UV-curable materials with refractive indices from 1.32 to 1.65, delivering essential functions and physical and chemical properties.","=HYPERLINK(""http://www.luvantixadm.com"")","Luvantix ADM Co., Ltd.  27, Gukjegwahak 8-ro  Yu-seong Gu  Korea, Republic of  34000"
3378,Luxinar Ltd.,"=HYPERLINK(""https://spie.org/ExhibitorDetail?ExpoID=5008&ExhibitorID=102067"")","Luxinar, a leader in laser technology, boasts 25+ years in CO₂ lasers up to 1000W and ultrashort pulse laser expertise. Headquartered in the UK, Luxinar has sales/service hubs in Asia, Europe, and North America, with thousands of global installations. Now partnered with Iradion Laser Sources, we provide a wider choice of laser sources, applications and international support across three continents. Our CO₂ laser range extends from 30 to 1000W and we offer a combined short pulse laser portfolio.","=HYPERLINK(""http://www.luxinar.com"")",Luxinar Ltd.  Bridgehead Business Park  Meadow Rd  Kingston upon Hull  United Kingdom  HU13 0DG
858,Luxium Solutions,"=HYPERLINK(""https://spie.org/ExhibitorDetail?ExpoID=5008&ExhibitorID=103414"")",No Description Found,"=HYPERLINK(""http://www.luxiumsolutions.com"")","Luxium Solutions  17900 Great Lakes Pkwy  Hiram, OH  United States  44234-9681"
5029,Lynred,"=HYPERLINK(""https://spie.org/ExhibitorDetail?ExpoID=5008&ExhibitorID=103464"")",No Description Found,"=HYPERLINK(""http://www.lynred.com"")",Lynred  364 Route de Valence  Veurey-Voroize  France  38113
2239,M Squared Lasers Ltd.,"=HYPERLINK(""https://spie.org/ExhibitorDetail?ExpoID=5008&ExhibitorID=102235"")","We are a photonics and quantum technology company on a mission to harness the power of light to change the world. Our award-winning laser platforms were designed to help scientists understand more about the world around them, but we’ve grown to become much more than a scientific laser engineering company. We’re helping to move novel science from the lab and into the real world and we’re dedicated to advancing the global scientific agenda through new technologies and exciting challenges.","=HYPERLINK(""http://www.m2lasers.com"")",M Squared Lasers Ltd.  1 Kelvin Campus WSSP/Venture Bldg  Maryhill Rd  Glasgow  United Kingdom  G20 0SP
3525,"Mad City Labs., Inc.","=HYPERLINK(""https://spie.org/ExhibitorDetail?ExpoID=5008&ExhibitorID=101254"")",No Description Found,"=HYPERLINK(""http://www.madcitylabs.com"")","Mad City Labs Inc  2524 Todd Dr  Madison, WI  United States  53713-2317"
1839,Mahr,"=HYPERLINK(""https://spie.org/ExhibitorDetail?ExpoID=5008&ExhibitorID=101585"")","When customers have metrology needs, they turn to Mahr Inc. for unmatched expertise. With over a century of experience, Mahr Inc. has become a leader in precision measurement. A member of the Mahr Group, the company has provided dimensional measurement solutions for more than 160 years. Mahr manufactures and supports a comprehensive range of equipment, from handheld gauges to advanced systems, measuring form, contour, surface finish, length, and optical metrology.","=HYPERLINK(""http://www.mahr.com"")","Mahr  1139 Eddy St  Providence, RI  United States  02905-4511"
3661,Maiman Electronics,"=HYPERLINK(""https://spie.org/ExhibitorDetail?ExpoID=5008&ExhibitorID=101829"")",No Description Found,"=HYPERLINK(""http://www.maimanelectronics.com"")",MES SOLUTIONS DOO  Parc Mediterrani de la Tecnologia  C/Esteve Terradas 1 Rdit  Barcelona  Spain  08860
201,"Marina Photonics, Inc.","=HYPERLINK(""https://spie.org/ExhibitorDetail?ExpoID=5008&ExhibitorID=101532"")",No Description Found,"=HYPERLINK(""http://www.marinaphotonics.com"")","Marina Photonics Inc  43221 Chapelton Dr  Bermuda Dunes, CA  United States  92203-1562"
3419,"Market Tech, Inc.","=HYPERLINK(""https://spie.org/ExhibitorDetail?ExpoID=5008&ExhibitorID=101558"")","Market Tech Inc. is a leading distributor of Lasers and Measurement Instrumentation for life science, medical, semiconductor, aerospace, quality control and research applications. We offer a wide variety of Diode Pumped Solid State and Diode Lasers, LED and Lamp sources covering UV, Visible and IR spectrum both pulsed and CW. We also offer Laser beam stabilization systems, Monochromators, Spectrometers, Spectroradiometers, Light Meters and Detectors.","=HYPERLINK(""http://www.markettechinc.net"")","Market Tech, Inc.  340 El Pueblo Rd Ste E  Scotts Valley, CA  United States  95066-4237"
237,Marktech Optoelectronics,"=HYPERLINK(""https://spie.org/ExhibitorDetail?ExpoID=5008&ExhibitorID=101688"")","Marktech designs, manufactures, packages & tests detection and emission solutions across the UV-Visible-NIR-SWIR-MWIR spectrum including phototodiodes, LEDs, InP epi wafers, custom components, & assemblies. Our latest innovations include award winning Optrans ATLAS hermetic SMD packaged InGaAs IR photodiodes, Silanna Safe 235nm UVC LEDs, silicon photodetectors, quadrants & arrays; SWIR LEDs; & multi-wavelength LED emitters with integral detectors. Marktech is a proud CREE-LED Solution provider.","=HYPERLINK(""http://www.marktechopto.com"")","Marktech Optoelectronics  3 Northway Ln N Ste 1  Latham, NY  United States  12110-2281"
3215,Marubeni America Corp.,"=HYPERLINK(""https://spie.org/ExhibitorDetail?ExpoID=5008&ExhibitorID=101707"")","Marubeni America Corporation is a supplier of IR, NIR and SWIR LEDs with wavelengths between 365nm and 1900nm in various packages. Multi-wavelength LEDs, COB, Flip Chip, Ultra Compact LED packages, High-power LED and custom options are available as well. Our high-quality LEDs are suitable for a variety of applications. More info at https://tech-led.com/. We are also a supplier of Wire Grid Polarizer that enhances NIR/SWIR performance and offers excellent heat resistance.","=HYPERLINK(""http://www.tech-led.com"")","Marubeni America Corp.  3979 Freedom Circle, Ste. 600  Santa Clara, CA  United States  95054"
5511,Masimo Semiconductor,"=HYPERLINK(""https://spie.org/ExhibitorDetail?ExpoID=5008&ExhibitorID=102475"")",No Description Found,"=HYPERLINK(""http://www.masimosemi.com"")","Masimo Semiconductor  25 Sagamore Park Rd  Hudson, NH  United States  03051-4901"
3311,Materion Balzers Optics,"=HYPERLINK(""https://spie.org/ExhibitorDetail?ExpoID=5008&ExhibitorID=101889"")",No Description Found,"=HYPERLINK(""http://www.materion.com/balzersoptics"")","Materion Balzers Optics  2 Lyberty Way  Westford, MA  United States  01886-3616"
4332,Materion Corp.,"=HYPERLINK(""https://spie.org/ExhibitorDetail?ExpoID=5008&ExhibitorID=102686"")","Materion drives innovation in optical coating materials, empowering industries like defense, aerospace, ophthalmics, lasers, communications, IR, and medical. Our evaporation materials and sputtering targets cover optical wavelengths from UV to far IR, offering unmatched versatility. With a portfolio spanning 70% of the periodic table—including fluorides, oxides, and precious/non-precious metals—we deliver advanced material solutions needed to meet today’s most demanding optical challenges.","=HYPERLINK(""http://www.materion.com"")","Materion Corp.  6070 Parkland Blvd  Mayfield Heights, OH  United States  44124-4191"
2236,"maxon precision motors, inc.","=HYPERLINK(""https://spie.org/ExhibitorDetail?ExpoID=5008&ExhibitorID=102849"")","We harness our motion control knowledge to develop high-precision, turnkey solutions. We manufacture customized drive systems using our off-the-shelf components, such as brushed and brushless DC motors, sensors, positioning and multi-axis controllers, and frameless direct drive solutions. Our expertise in vacuum compatibility, high-temperature resistance, low electromagnetic interference, special materials, and long service life enable us to excel in the medical and semiconductor industries.","=HYPERLINK(""http://www.maxongroup.us"")","maxon precision motors, inc.  125 Dever Rd  Taunton, MA  United States  02780-7910"
3640,"Meadowlark Optics, Inc.","=HYPERLINK(""https://spie.org/ExhibitorDetail?ExpoID=5008&ExhibitorID=101623"")","Meadowlark Optics designs, develops, and manufactures polarization systems and components including liquid crystal devices from the UV to MWIR. Standard products include spatial light modulators (high power, high speed, low phase ripple), shutters, rotators, waveplates/retarders, polarizers, and polarimeters. New products include Liquid Crystal Stokes Vector Polarimeter and Liquid Crystal Polarization Gratings for remote focusing & beam steering., and high-power & high speed SLMs.","=HYPERLINK(""http://www.meadowlark.com"")","Meadowlark Optics, Inc.  5964 Iris Pkwy  Frederick, CO  United States  80504-6412"
5317,Mecademic Robotics,"=HYPERLINK(""https://spie.org/ExhibitorDetail?ExpoID=5008&ExhibitorID=103299"")","Mecademic applies innovative engineering and architectural simplicity to build the world’s most precise and compact industrial robots in their categories. With plug-and-work systems, a tiny footprint, and reduced energy consumption, Mecademic’s robots are in over 40 countries, enabling the highest precision in microautomation at some of the world’s biggest brands, emerging disruptors, and academic institutions.","=HYPERLINK(""http://mecademic.com"")","Mecademic Robotics  1300 Rue Saint-Patrick  Montreal, QC  Canada  H3K 1A4"
2548,MEETOPTICS,"=HYPERLINK(""https://spie.org/ExhibitorDetail?ExpoID=5008&ExhibitorID=102461"")","The largest database in Optics and Photonics. We help researchers and engineers to quickly find, filter, and compare optical components from global suppliers.","=HYPERLINK(""http://www.meetoptics.com"")","MEETOPTICS  Carrer Jordi Girona 1-3, C3, S 1  Barcelona  Spain  08034"
3628,"MegaWatt Lasers, Inc.","=HYPERLINK(""https://spie.org/ExhibitorDetail?ExpoID=5008&ExhibitorID=101277"")","MegaWatt Lasers manufactures application-specific solid-state lasers and components for medical, industrial, and defense applications. Standard products include a complete line of high-quality diffuse-reflector pump chambers for solid-state laser applications. Our pump chamber designs are well suited for both breadboard experimentation as well as OEM applications. MegaWatt Lasers is known for its line of Eyesafe Er: Glass microlasers for various remote sensing applications.","=HYPERLINK(""http://www.megawattlasers.com"")","MegaWatt Lasers, Inc.  PO Box 24190  Hilton Head Island, SC  United States  29925-4190"
1940,"Meller Optics, Inc.","=HYPERLINK(""https://spie.org/ExhibitorDetail?ExpoID=5008&ExhibitorID=101318"")","Meller Optics has been providing high quality optics to defense, medical, laser and industrialmarkets for over 50 years. Specializing in grinding and polishing of hard, durable materials. Meller has developed high-speed, low-cost finishing processes for Sapphire, Ruby, Laser Glasses, FusedSilica, Zinc Selenide, Germanium, Silicon, Fluorides and Ceramics. Configurations include windows,substrates, lenses, domes and prisms. Meller Optics is an ISO9001:2008certifiedand ITARregistered.","=HYPERLINK(""http://www.melleroptics.com"")","Meller Optics, Inc.  120 Corliss St  Providence, RI  United States  02904-2602"
3205,Menhir Photonics AG,"=HYPERLINK(""https://spie.org/ExhibitorDetail?ExpoID=5008&ExhibitorID=101521"")","Menhir Photonics offers cutting edge ultrafast lasers and related photonics solutions. Our lasers, the MENHIR-1550 and MENHIR-1030, have the highest reliability found on the market. Usage-case is in all the research and high-end applications requiring ultra-low phase noise on long-term, combined with the highest reliability. Examples are frequency metrology, low-noise RF generation, timing distribution,... Discover more by chatting with us!","=HYPERLINK(""http://menhir-photonics.com"")",Menhir Photonics AG  Industriestrasse 42  Glattbrugg  Switzerland  8152
827,Menlo Systems GmbH,"=HYPERLINK(""https://spie.org/ExhibitorDetail?ExpoID=5008&ExhibitorID=102827"")","We are a leading developer and global supplier of cutting-edge enabling tools for high-precision photonics and quantum technologies. We are known for our Nobel-Prize winning optical frequency comb technology, and instrumentation for the most demanding applications. Our main product lines are: optical frequency combs, terahertz time domain solutions, time and frequency distribution systems, and ultrafast and ultrastable lasers.","=HYPERLINK(""http://www.menlosystems.com"")",Menlo Systems GmbH  Bunsenstr. 5  Martinsried  Germany  82152
4136,"menovex Medical Technology (Shenzhen) Co,. Ltd.","=HYPERLINK(""https://spie.org/ExhibitorDetail?ExpoID=5008&ExhibitorID=102672"")",No Description Found,"=HYPERLINK(""http://www.menovex.com"")","menovex Medical Technology (Shenzhen) Co,. Ltd.  No 14, Jinhui Road, Kinsha Community, Kengzi Str.  Shenzhen, GD  China  518122"
367,Meopta s.r.o.,"=HYPERLINK(""https://spie.org/ExhibitorDetail?ExpoID=5008&ExhibitorID=102201"")",No Description Found,"=HYPERLINK(""http://www.meopta.com"")",Meopta s.r.o.  Kabelíkova 1  Prerov  Czech Republic  750 02
3670,"Mesa Photonics, LLC","=HYPERLINK(""https://spie.org/ExhibitorDetail?ExpoID=5008&ExhibitorID=101783"")",No Description Found,"=HYPERLINK(""http://www.mesaphotonics.com"")","Mesa Photonics LLC  1550 Pacheco St  Santa Fe, NM  United States  87505-3914"
4205,MESSTEC Power Converter GmbH,"=HYPERLINK(""https://spie.org/ExhibitorDetail?ExpoID=5008&ExhibitorID=103247"")","MESSTEC Power Converter is mainly focused on 3 business areas: -Development and production of laser drivers, TEC controllers and OEM laser modules -Electronic and mechanical production -Development, engineering and construction in the business field of laser drivers. Depending on customers´ requests we manufacture, assemble, wire and test single components or complete electro-mechanical devices and modules. We are on the way to thinking about electronics in a sustainable way.","=HYPERLINK(""http://www.powerconverter.com/"")",MESSTEC Power Converter GmbH  Grube 41  Penzberg  Germany  82377
2101,"Metalized Ceramics & Braze Solutions, Inc.","=HYPERLINK(""https://spie.org/ExhibitorDetail?ExpoID=5008&ExhibitorID=102007"")",No Description Found,"=HYPERLINK(""http://mcbsusa.com"")","Metalized Ceramics & Braze Solutions Inc  1325 N Red Gum St Ste 4  Anaheim, CA  United States  92806-6301"
2466,"MFOPTEX Co., Ltd.","=HYPERLINK(""https://spie.org/ExhibitorDetail?ExpoID=5008&ExhibitorID=102634"")","MFOPTEX is a Japanese Corporation formed by the spin-off of the Optical Components Division of Mitsubishi Cable Industries, and jointly owned by Mitsubishi Cable Industries and Furukawa Electric. This allows us to utilize the specialty fiber manufacturing and components processing technologies of Mitsubishi Cable coupled with Furukawa’s optical fiber manufacturing technology and optical product components to develop and manufacture products for medical, industrial, and scientific applications.","=HYPERLINK(""http://www.mfoptex.com"")","MFOPTEX Co., Ltd.  8, Nishinomachi, Higashi-Mukojima  Amagasaki  Japan  660-0856"
1740,MGG Micro-Glühlampen-Gesellschaft Menzel GmbH,"=HYPERLINK(""https://spie.org/ExhibitorDetail?ExpoID=5008&ExhibitorID=102857"")",No Description Found,"=HYPERLINK(""http://www.mgg-lamps.de/en"")",MGG Micro-Glühlampen-Gesellschaft Menzel GmbH  Hamburger Landstrasse 1  Wentorf  Germany  D-21465
330,"Micro Laser Systems, Inc.","=HYPERLINK(""https://spie.org/ExhibitorDetail?ExpoID=5008&ExhibitorID=101765"")",No Description Found,"=HYPERLINK(""http://www.microlaser.com"")","Micro Laser Systems Inc  12841 Western Ave Ste H  Garden Grove, CA  United States  92841-4025"
3510,Micro Photon Devices S.r.l.,"=HYPERLINK(""https://spie.org/ExhibitorDetail?ExpoID=5008&ExhibitorID=102736"")","Micro Photon Devices in-depth know-how of SPAD device fabrication and active quenching electronics led the company to develop and market a comprehensive family of single photon avalanche diodes silicon, CMOS or InGaAs/InP technologies. MPD products have ultra-fast timing resolution, high photon detection efficiency, low power consumption, high robustness and reliability.","=HYPERLINK(""http://www.micro-photon-devices.com"")",Micro Photon Devices S.r.l.  Via Walter Gebert Deeg 3E  Bolzano  Italy  39100
5206,MicroAlign,"=HYPERLINK(""https://spie.org/ExhibitorDetail?ExpoID=5008&ExhibitorID=103372"")","MicroAlign is a deep-tech Dutch startup and spin-off of the Eindhoven University of Technology.Our revolutionary technology enables for the first time to optimally connect many densely spaced fibers to multiport optical components, all at the same time and with individual sub-micrometer accuracy. At MicroAlign we aim to leverage our core technology to develop the next generation of ultra-high accuracy fiber arrays, featuring pitch accuracy better than ±0.1 μm.As such, MicroAlign ultra-high acc","=HYPERLINK(""http://www.microalign.nl"")",MicroAlign  Het Eeuwsel 57  Eindhoven  Netherlands  5612 AS
2166,MICRO-EPSILON Messtechnik GmbH & Co. KG,"=HYPERLINK(""https://spie.org/ExhibitorDetail?ExpoID=5008&ExhibitorID=103403"")","Cutting-edge technology for high precision measurements, like interferometer, confocal chromatic sensors, deflectometry, etc.. Micro-Epsilon offers the largest range of high precision displacement sensors, infrared temperature sensors, color sensors as well as dimensional measurement devices and systems for industrial applications.","=HYPERLINK(""http://www.micro-epsilon.com"")",MICRO-EPSILON Messtechnik GmbH & Co. KG  Königbacherstr 15  Ortenburg  Germany  94496
2168,"Micro-Hybrid Electronics, Inc.","=HYPERLINK(""https://spie.org/ExhibitorDetail?ExpoID=5008&ExhibitorID=102763"")","Micro-Hybrid Electronics offers advanced infrared sensor solutions for gas analysis and temperature measurement in medical, industrial, environmental, and agricultural fields. As leaders in IR components, we uniquely provide both IR emitters and detectors. Our NDIR products come as wafers or in TO/SMD packages, standard or customized. We ensure top performance and cost efficiency. Specializing in complex OEM projects, we deliver significant advantages through our comprehensive value chain.","=HYPERLINK(""http://www.microhybrid.us"")","Micro-Hybrid Electronics, Inc.  9030 S Rita Rd Ste 122  Tucson, AZ  United States  85747-9102"
763,"Micro-LAM, Inc.","=HYPERLINK(""https://spie.org/ExhibitorDetail?ExpoID=5008&ExhibitorID=102053"")","Micro-LAM revolutionizes optics manufacturing through vertical integration, uniting patented OPTIMUS technology with M10 Diamond Tools and 603 OPTX, ensuring unmatched precision and innovation.","=HYPERLINK(""http://www.micro-lam.com"")","Micro-LAM, Inc.  5870 S Sprinkle Rd, Unit 3  Portage, MI  United States  49002-9712"
4829,"MICRONIX USA, LLC","=HYPERLINK(""https://spie.org/ExhibitorDetail?ExpoID=5008&ExhibitorID=101476"")","Founded in 2006, MICRONIX USA specializes in miniature micro- and nano-positioning components and systems for the life science, spectroscopy, microscopy, optical and research markets. It is noteworthy that MICRONIX USA is the only company based in the USA that designs and manufactures miniature positioner. In addition to our extensive standard product line, we provide rapid product development services ranging from customization of existing products to complete custom designs.","=HYPERLINK(""http://www.micronixusa.com"")","MICRONIX USA, LLC  11555 Coley River Cir Ste A  Fountain Valley, CA  United States  92708-4224"
