Booth Number(s),Company Name,Link to Company,Description,Website link,Company Contact Information
254,"Eoptic, Inc.","=HYPERLINK(""https://spie.org/ExhibitorDetail?ExpoID=5008&ExhibitorID=101444"")","Eoptic is a dynamic imaging and optics systems integrator that delivers complex electro-optical hardware/software solutions to provide valuable insights across industries. Our custom imaging and optical metrology solutions service a diverse industry landscape in order to solve a wide array of inspection, detection, and characterization needs. The throughline across industries is our expertise in harnessing the power of the electromagnetic spectrum to solve difficult imaging problems.","=HYPERLINK(""http://eoptic.com"")","Eoptic, Inc.  350 East Ave  Rochester, NY  United States  14604-2604"
368,"EOTECH, LLC.","=HYPERLINK(""https://spie.org/ExhibitorDetail?ExpoID=5008&ExhibitorID=101629"")",No Description Found,"=HYPERLINK(""http://www.eotechinc.com"")","EOTech Inc  46900 Port St  Plymouth, MI  United States  48170-6035"
5200,EPIC-European Photonics Industry Consortium,"=HYPERLINK(""https://spie.org/ExhibitorDetail?ExpoID=5008&ExhibitorID=101752"")","EPIC is the leading industry association that promotes the sustainable development of organizations working in the field of photonics in Europe. We foster a vibrant photonics ecosystem by maintaining a strong network and acting as a catalyst and facilitator for technological and commercial advancement. EPIC publishes market and technology reports, organizes technical workshops and B2B roundtables, supports EU funding proposals, advocacy and lobbying, education and many more.","=HYPERLINK(""http://www.epic-photonics.com"")",EPIC-European Photonics Industry Consortium  17 rue de L'Hamelin  Paris  France  75016
4205,EPIGAP OSA Photonics GmbH,"=HYPERLINK(""https://spie.org/ExhibitorDetail?ExpoID=5008&ExhibitorID=103184"")","EPIGAP OSA Photonics GmbH produces and distributes LED chips, SMD & THT LEDs, photodiodes, as well as CoB modules in the wavelength range of 230 nm to 2300 nm for energy-efficient, smart, and future-proof products in the fields of industrial sensor technology, security technology, and medical technology.","=HYPERLINK(""http://www.epigap-osa.de"")","EPIGAP OSA Photonics GmbH  Köpenicker Str. 325, Haus 40  Berlin  Germany  12555"
3214,Epner Technology Inc.,"=HYPERLINK(""https://spie.org/ExhibitorDetail?ExpoID=5008&ExhibitorID=102251"")",No Description Found,"=HYPERLINK(""http://www.epner.com"")","Epner Technology Inc  279 Frost St  Brooklyn, NY  United States  11222-5601"
2001,"Epolin, LLC","=HYPERLINK(""https://spie.org/ExhibitorDetail?ExpoID=5008&ExhibitorID=101665"")","Epolin has pioneered the development and manufacture of near-infrared absorbing dyes, inks, and thermoplastic compounds. We are known the world over for our expertise in optimizing near-infrared and visible light transmittance in plastic injected molded & cast parts, film extrusions, laminates, pressure sensitive adhesives, and coatings.","=HYPERLINK(""http://www.epolin.com"")","Epolin, LLC  358-364 Adams St  Newark, NJ  United States  07105"
5529,Epoxy Technology Inc.,"=HYPERLINK(""https://spie.org/ExhibitorDetail?ExpoID=5008&ExhibitorID=102823"")","Discover our range of EPO-TEK® specialty adhesives designed for your challenging photonics applications. Our optical and UV-curing adhesives offer unique properties, are ISO 9001 Certified, RoHS, and REACH Compliant. Our products excel in optical transmission, high bond strength, and harsh environment performance, meeting NASA/MIL-STD/Telcordia standards. From fiber optic, laser, camera and LIDAR applications, our EPO-TEK® adhesives provide solutions for diverse photonics needs.","=HYPERLINK(""http://www.epotek.com"")","Epoxy Technology Inc.  14 Fortune Dr  Billerica, MA  United States  01821"
4329,"Esco Optics, Inc.","=HYPERLINK(""https://spie.org/ExhibitorDetail?ExpoID=5008&ExhibitorID=102232"")","Esco Optics is a ITAR certified highly adaptable optics manufacturer for over 65 years. With capabilities ranging from custom prototyping to large-run manufacturing and a full compliment of catalog optics available. We process IR, UV, low-expansion, and crystals in our Oak Ridge, NJ, facility for the defense, medical, automotive, and aerospace industries. We are dedicated to building long-lasting partnerships and helping our clients thrive.","=HYPERLINK(""http://www.escooptics.com"")","Esco Optics, Inc.  95 Chamberlain Rd  Oak Ridge, NJ  United States  07438-8853"
3471,ESPROS Photonics AG,"=HYPERLINK(""https://spie.org/ExhibitorDetail?ExpoID=5008&ExhibitorID=102545"")","ESPROS Photonics is a photonics technology company located in Switzerland, with subsidiaries in China and the USA. The company is built around a unique CMOS/CCD process developed and owned by ESPROS. Products are TOF and LiDAR imagers as well as custom ASICS. We also develop and produce 3D camera modules, all based on our own 3D imagers. We serve our customers with the only non-captive high performance CMOS process with optical frontend worldwide.","=HYPERLINK(""http://www.espros.com"")",ESPROS Photonics AG  St Gallerstrasse 135  Sargans  Switzerland  7320
4341,EssentOptics Europe,"=HYPERLINK(""https://spie.org/ExhibitorDetail?ExpoID=5008&ExhibitorID=103339"")",No Description Found,"=HYPERLINK(""http://www.essentoptics.com"")","EssentOptics Europe  Mokslininku st 2A  Vilnius, Vilniaus  Lithuania  08412"
4937,Eulitha AG,"=HYPERLINK(""https://spie.org/ExhibitorDetail?ExpoID=5008&ExhibitorID=101576"")","Eulitha provides nanolithography services and equipment for applications in AR/VR, photonics, optoelectronics, biotechnology, telecommunication, photovoltaics and other areas. Its revolutionary PHABLE photolithography systems enable low-cost fabrication of periodic nanostructures over large areas.","=HYPERLINK(""http://www.eulitha.com"")",Eulitha AG  Grosszelgstrasse 21  Würenlos  Switzerland  5436
1943,"Evaporated Coatings, Inc.","=HYPERLINK(""https://spie.org/ExhibitorDetail?ExpoID=5008&ExhibitorID=101463"")","Evaporated Coatings, Inc. has been supplying high precision optical coatings for more than 60 years. Vacuum deposition technology has progressed significantly over the years and ECI has remained on the forefront of this dynamic field. ECI has developed many original thin film designs and processes. Current coating designs are applied using some of the newest and most innovated deposition methods. ECI offers its customers a rare combination of technical depth, and personalized service.","=HYPERLINK(""http://www.evaporatedcoatings.com"")","Evaporated Coatings, Inc.  2365 Maryland Rd  Willow Grove, PA  United States  19090-1708"
3413,Evatec NA Inc.,"=HYPERLINK(""https://spie.org/ExhibitorDetail?ExpoID=5008&ExhibitorID=101864"")",No Description Found,"=HYPERLINK(""http://www.evatecnet.com"")","Evatec NA Inc.  5562 NE Clara Ln  Hillsboro, OR  United States  97124-8599"
1967,"Everix, Inc.","=HYPERLINK(""https://spie.org/ExhibitorDetail?ExpoID=5008&ExhibitorID=101940"")","At Everix, we employ a novel and cost-effective manufacturing process to produce a wide range of optical filters for AR/VR, consumer electronics, biomedical and industrial applications. We do not rely on traditional deposition coating techniques to make our filters, thus we can design and produce the worlds' thinnest optical filters with near zero angular shift optical performance. Our filters are available in flexible or rigid designs and can be cut to the customers' desired form factor.","=HYPERLINK(""http://www.everix.co"")","Everix, Inc.  1468 N Goldenrod Rd Ste 200  Orlando, FL  United States  32807-8368"
2134,Evident,"=HYPERLINK(""https://spie.org/ExhibitorDetail?ExpoID=5008&ExhibitorID=102761"")","Olympus Scientific Solutions is now Evident. Although our name is new, we still offer the same products, solutions, and services that you trust. The Evident OEM team is dedicated to assisting engineers and system designers with part selection of microscope components for integration into systems and equipment for imaging, detection, or analysis. Visit our booth to learn about new off-the-shelf objective lenses, tube lenses, and microcopy components for compact imaging instrumentation.","=HYPERLINK(""http://www.EvidentScientific.com"")","Evident  48 Woerd Ave  Waltham, MA  United States  02453-3826"
5039,Exail SAS,"=HYPERLINK(""https://spie.org/ExhibitorDetail?ExpoID=5008&ExhibitorID=101728"")","Exail is a leading high-tech industrial group specializing in cutting-edge robotics, maritime, navigation, aerospace and photonics technologies. With a full range of robust in-house manufactured components, products and systems, Exail helps photonics engineers all around the world to get the most out of the light by providing high performance, innovative and reliable photonic solutions for application in communications, fibers-based sensors, space, lasers and quantum technologies.","=HYPERLINK(""http://www.exail.com"")",Exail SAS  34 Rue de la Croix de Fer  Saint-Germain-en-Laye  France  78100
4040,Exaktera LLC,"=HYPERLINK(""https://spie.org/ExhibitorDetail?ExpoID=5008&ExhibitorID=101301"")",No Description Found,"=HYPERLINK(""http://www.exaktera.com"")","Exaktera LLC  200 Newbury St  Boston, MA  United States  02116-2504"
3324,EXALOS AG,"=HYPERLINK(""https://spie.org/ExhibitorDetail?ExpoID=5008&ExhibitorID=101549"")","Founded in 2003, EXALOS, an indie Semiconductor company (Nasdaq: INDI), is a Swiss-based technology driven company, which focuses on the design, development, manufacturing and sales of advanced light source solutions based on Superluminescent Light Emitting Diodes (Visible and Near-IR) and Visible Laser Diodes. EXALOS’s product portfolio includes driver electronics and balanced receivers which are complementary to our light source offerings. EXALOS has shipped more than 800,000 SLEDs to date.","=HYPERLINK(""http://www.exalos.com"")",EXALOS AG  Wagistrasse 21  Schlieren  Switzerland  8952
641,Excelitas,"=HYPERLINK(""https://spie.org/ExhibitorDetail?ExpoID=5008&ExhibitorID=102188"")","Excelitas is the leading provider of advanced, life-enriching technologies that make a difference, serving global market leaders in the Life Sciences, Advanced Industrial, next-generation Semiconductor, Aerospace and Defense end-markets. Excelitas is an essential partner in the design, development, and manufacture of photonic technologies, offering leading-edge innovation in sensing, detection, imaging, optics, and specialty illumination for customers worldwide.","=HYPERLINK(""http://www.excelitas.com"")","Excelitas  2545 Railroad Street, Suite 300  Pittsburgh, PA  United States  15222"
621,Excell Technology,"=HYPERLINK(""https://spie.org/ExhibitorDetail?ExpoID=5008&ExhibitorID=102759"")","We specialize in selling New and Rebuilt Grinders, Polishers, Laps & Saws - Since 1984 We deal with Speedfam, Strasbaugh, STC, Gigamat, Lapmaster, Hoffman, Peter Wolters, Blanchard and more. We provide long-term warranties. Come visit our facility 20 minutes from SFO and SJC airports.","=HYPERLINK(""http://www.excelltechnology.com"")","Excell Technology  1001 Varian St  San Carlos, CA  United States  94070"
5009,Exciton,"=HYPERLINK(""https://spie.org/ExhibitorDetail?ExpoID=5008&ExhibitorID=102284"")","For over 50 years Exciton has excelled in the design and production of high purity and high-performance dyes. Our expertise includes Narrow Band Visible and Infrared Absorber dyes for optical filters, Fluorescent and the closely related Laser dyes. We are proud to announce the opening of our new laboratory in Columbus Ohio. Since early 2017 Exciton has been part of EssilorLuxottica, the leader in the design, manufacture and distribution of fashion, luxury, and sports eyewear.","=HYPERLINK(""http://exciton.luxottica.com"")","Exciton  2150 Bixby Rd  Lockbourne, OH  United States  43137-9273"
5317,EXFO Inc,"=HYPERLINK(""https://spie.org/ExhibitorDetail?ExpoID=5008&ExhibitorID=103300"")","EXFO www.exfo.com develops smarter test, monitoring and analytics solutions for the global communications industry. Network equipment manufacturers (NEMs), component vendors, and academic and research labs around the world rely on our products for repeatable and accurate results —from the lab through production. We support end-to-end test & measurement with future-proof solutions.","=HYPERLINK(""http://www.exfo.com"")","EXFO Inc  400 Godin Ave  Quebec, QC  Canada  G1M 2K2"
405,"ExOptronics, Inc.","=HYPERLINK(""https://spie.org/ExhibitorDetail?ExpoID=5008&ExhibitorID=103402"")",No Description Found,"=HYPERLINK(""http://www.exoptronics.com"")","ExOptronics, Inc.  1168 N Knollwood Cir  Anaheim, CA  United States  92801-1307"
1827,Exosens S.A.S.,"=HYPERLINK(""https://spie.org/ExhibitorDetail?ExpoID=5008&ExhibitorID=101640"")","EXOSENS is a high-tech company, with more than 85 years of experience in the innovation, development, manufacture and sale of technologies in the field of particles and photo detection and imaging. Today, it offers its customers detectors and detection solutions: its travelling wave tubes, advanced cameras, neutron & gamma detectors, instrument detectors and light intensifier tubes allow EXOSENS to respond to complex issues in environments extremely demanding by offering tailor-made solutions.","=HYPERLINK(""http://www.exosens.com"")",Exosens S.A.S.  18 Avenue Pythagore  Merignac  France  33700
4543,"Exotech, Inc.","=HYPERLINK(""https://spie.org/ExhibitorDetail?ExpoID=5008&ExhibitorID=101961"")","Exotech is a leading global recycler and manufacturer of exotic metals. For more than 30 years, we've changed the way exotic scrap metal is purchased and processed. The success of our company lies in our skilled team of experts, and more than 150 years of combined experience. At Exotech, we know how to solve tough challenges. We've built a reputation worldwide for our innovative solutions.","=HYPERLINK(""http://exotech.com"")","Exotech, Inc.  1851 Blount Rd  Pompano Beach, FL  United States  33069-5106"
1167,"Fairchild Imaging, Inc.","=HYPERLINK(""https://spie.org/ExhibitorDetail?ExpoID=5008&ExhibitorID=102244"")","Fairchild Imaging designs and manufactures high performance imaging sensors. Our ultra-low-light and extreme-low-noise image sensors with sCMOS 3.1 technology onboard are capable of photon counting in 4K resolution, and imaging in overcast starlight. Our custom and standard x-ray imaging sensors assist in medical diagnosis and inspection applications.","=HYPERLINK(""http://www.fairchildimaging.com"")","Fairchild Imaging, Inc.  1841 Zanker Rd Ste 50  San Jose, CA  United States  95112-4223"
4006,FAULHABER MICROMO,"=HYPERLINK(""https://spie.org/ExhibitorDetail?ExpoID=5008&ExhibitorID=102830"")","We create motion – Drive systems from FAULHABER are masterpieces of precision engineering and electromechanics at the limits of the technically feasible. The drive specialist offers the most extensive range of miniature and micro drive systems available from a single source worldwide. FAULHABER is a leading supplier in the area of high precision miniature and micro drive systems, from high performance DC Motors, BLDC Motors, to Linear Motors, Stepper Motors and more!","=HYPERLINK(""http://www.faulhaber.com"")","FAULHABER MICROMO  14881 Evergreen Ave  Clearwater, FL  United States  33762-3008"
3226,Femtika UAB,"=HYPERLINK(""https://spie.org/ExhibitorDetail?ExpoID=5008&ExhibitorID=101614"")","FEMTIKA, founded in 2013, is a leading provider of advanced laser microfabrication solutions in multiphoton polymerization and selective laser etching. The cutting-edge technology allows precise and efficient processing in a wide range of industries, including microelectronics, medical devices, and aerospace engineering. Our state-of-the-art facility is equipped with the latest equipment and technology, allowing us to provide our clients with the highest level of service and support.","=HYPERLINK(""http://www.femtika.com"")",Femtika UAB  Keramikų g. 2  Vilnius  Lithuania  10233
4027,Femto Easy,"=HYPERLINK(""https://spie.org/ExhibitorDetail?ExpoID=5008&ExhibitorID=103049"")","Femto Easy is a company specialized in ultrafast lasers metrology. We have a strong expertise in the production and characterization of high energy ultrashort pulses and we provide robust and reliable measurement devices for ultrafast lasers, both for scientific and industrial applications. Our autocorrelators and FROG systems are compact, robust, easy to use and provide unparalleled accuracy. For non-ultrafast lasers, we provide the most comprehensive range of laser beam profilers","=HYPERLINK(""http://femtoeasy.eu"")","Femto Easy  Bât Gienah, Cité de la Photonique  11 avenue de Canteranne  Pessac  France  33600"
3453,FEMTOprint SA,"=HYPERLINK(""https://spie.org/ExhibitorDetail?ExpoID=5008&ExhibitorID=101322"")","FEMTOprint is a Swiss high-tech, Contract Development and Manufacturing Organization specialized in high-precision, 3D printing in glass. With the proprietary laser-based FEMTOPRINT® microfabrication platform, we offer truly free-form surface/volume definition, welding, ablative, and surface treatment solutions in glass, thus, creating advanced, highly precise, and functionalized microdevices in micro-optical, photonic, quantum, microfluidic, microelectronic, and micromechanical applications.","=HYPERLINK(""http://www.femtoprint.ch"")",FEMTOprint SA  Via Campagna 16  Agno  Switzerland  6982
5317,FEMTUM,"=HYPERLINK(""https://spie.org/ExhibitorDetail?ExpoID=5008&ExhibitorID=103294"")","Femtum drives innovation in mid-infrared fiber lasers, offering OEM pulsed nanosecond to femtosecond lasers at 3 μm wavelengths. These lasers enable precision applications by leveraging strong absorption in organic materials and transparency in semiconductors. Compact, modular, and reliable, our solutions power advancements in electronics, photonics, medical and biotech industries, and R&D. Femtum is committed to redefining manufacturing and scientific possibilities.","=HYPERLINK(""http://femtum.com"")","FEMTUM  2nd Fl  1405, Boulevard du Parc Technologique  Quebec, QC  Canada  G1P 4P5"
4205,"Ferdinand-Braun-Institut gGmbH, Leibniz-Institut für Höchstfrequenztechnik","=HYPERLINK(""https://spie.org/ExhibitorDetail?ExpoID=5008&ExhibitorID=103212"")","The FBH is an application-oriented research institute in the fields of high-frequency electronics, photonics & quantum physics. It researches electronic & optical components, modules & systems based on III-V semiconductors. Developments include high-power diode lasers with excellent beam quality, hybrid laser modules as well as UV LEDs & systems. Applications range from medical technology, high-precision metrology & sensors to optical communications in space & integrated quantum technology.","=HYPERLINK(""http://www.fbh-berlin.de"")","Ferdinand-Braun-Institut gGmbH, Leibniz-Institut für Höchstfrequenztechnik  Gustav-Kirchhoff-Str 4  Berlin  Germany  12489"
1834,Ferrotec (USA) Corp.,"=HYPERLINK(""https://spie.org/ExhibitorDetail?ExpoID=5008&ExhibitorID=101611"")",No Description Found,"=HYPERLINK(""http://www.ferrotec.com"")","Ferrotec (USA) Corp  566 Exchange Court  Livermore, CA  United States  94550"
3675,"FIAlab Instruments, Inc.","=HYPERLINK(""https://spie.org/ExhibitorDetail?ExpoID=5008&ExhibitorID=102877"")",No Description Found,"=HYPERLINK(""http://www.flowinjection. com"")","FIAlab Instruments Inc  4259 23rd Ave W  Seattle, WA  United States  98199-1534"
4614,"Fiber Optic Ctr., Inc.","=HYPERLINK(""https://spie.org/ExhibitorDetail?ExpoID=5008&ExhibitorID=101483"")",No Description Found,"=HYPERLINK(""http://www.focenter.com"")","Fiber Optic Ctr Inc  23 Centre St  New Bedford, MA  United States  02740-6322"
5042,FiberBridge Photonics GmbH,"=HYPERLINK(""https://spie.org/ExhibitorDetail?ExpoID=5008&ExhibitorID=101643"")","FBP provides optical fiber components for material processing, quantum technology and aerospace industries. Key products are high-power capable fiber arrays for coherent and incoherent beam combining. We also offer kW-class pump combiner, cladding power stripper and fiber end caps. We offer tailored solutions for fiber optic components and assemblies, from design to volume production – including harsh environment applications, e.g. in the aerospace industry. Made in Germany / ISO 9001-Certified","=HYPERLINK(""http://www.fiberbridge-photonics.com"")",FiberBridge Photonics GmbH  Hollerithallee 17  Hannover  Germany  30419
5123,Fibercore Ltd.,"=HYPERLINK(""https://spie.org/ExhibitorDetail?ExpoID=5008&ExhibitorID=102216"")","Founded 1982, Fibercore is a leading innovator, designer and manufacturer of specialty fiber serving customers across the world. Products include specialty fiber for the Aerospace, Defence, Telecommunications, Oil and Gas, Energy, Medical and Fiber Laser industries – the business is a global market leader. The company’s operations are headquartered in Fibercore House, a custom built Southampton based facility, in the UK.","=HYPERLINK(""http://www.fibercore.com"")",Fibercore Ltd.  Fibercore House  Southampton  United Kingdom  SO16 7QQ
362,"Fiberoptic Systems, Inc.","=HYPERLINK(""https://spie.org/ExhibitorDetail?ExpoID=5008&ExhibitorID=101596"")","Fiberoptic Systems, Inc. offers fiber optic assemblies to our OEM customers. In business for 42 years, we make our own borosilicate fiber here on the West Coast. We serve multiple markets including, medical, spectroscopy, machine vision, industrial, IR & UV. Visit our website to view examples of our capabilities and check out our online design guide to help you understand the various fibers available, the number of fibers, and the external transmission expected from your design.","=HYPERLINK(""http://www.fiberopticsystems.com"")","Fiberoptic Systems, Inc.  60 Moreland Rd Ste A  Simi Valley, CA  United States  93065-1643"
5107,"Fiberoptics Technology, Inc.","=HYPERLINK(""https://spie.org/ExhibitorDetail?ExpoID=5008&ExhibitorID=101267"")","An ITAR registered American manufacturer of stock and custom/engineered fiberoptic solutions of Glass (Borosilicate), Silica (Quartz), Plastic (PMMA) optical fibers, assemblies, bundles and patch cords. As well as value added custom subassemblies for variety of OEM applications within academic, analytical instruments, biomedical, illumination, industrial, laser delivery, life sciences, machine vision, medical, microscopy, military/defense, pyrometry, scientific, sensing, and spectroscopy.","=HYPERLINK(""http://www.fiberopticstech.com"")","Fiberoptics Technology, Inc.  1 Quassett Rd  Pomfret, CT  United States  06258"
2042,"FIBERPRO, Inc.","=HYPERLINK(""https://spie.org/ExhibitorDetail?ExpoID=5008&ExhibitorID=103056"")",No Description Found,"=HYPERLINK(""http://www.fiberpro.com"")","FIBERPRO Inc  26-55, Gajeongbuk-ro  Yuseong-gu, Daejeon  Korea, Republic of  34113"
3418,Fibertech Optica Inc.,"=HYPERLINK(""https://spie.org/ExhibitorDetail?ExpoID=5008&ExhibitorID=101703"")","A leader in the design and manufacture of integrated specialty fiber optic solutions, FTO offers precision micro optical assemblies, bundles, v-groove arrays, Raman & reflectance probes, high power laser cables and vacuum feedthrough for use from Deep UV to MIR wavelengths. FTO also offers multi-wavelength fiber-coupled LED illumination and calibration light sources to generate arbitrary spectral output profiles. Our light sources can support up to 18 channels.","=HYPERLINK(""http://www.fibertech-optica.com"")","Fibertech Optica Inc.  330 Gage Ave Suite 1  Kitchener, ON  Canada  N2M 5C6"
4205,fiberware Generalunternehmen für Nachrichtentechnik GmbH,"=HYPERLINK(""https://spie.org/ExhibitorDetail?ExpoID=5008&ExhibitorID=103213"")",No Description Found,"=HYPERLINK(""http://www.fiberware.de"")",Fiberware GmbH  Bornheimer Str. 4  Mittweida  Germany  09648
4841,ficonTEC Service GmbH,"=HYPERLINK(""https://spie.org/ExhibitorDetail?ExpoID=5008&ExhibitorID=102199"")","ficonTEC is the recognized market leader for automated assembly and testing systems for high-end photonic components, devices and PICs (photonics integrated circuits). Considerable process capability and dedicated assembly, test and packaging technologies have been accumulated in serving the needs of a broad selection of industry segments. Our maxim ‘Manufacturing Made Light’ embodies the goal of making the manufacture of light-enabled modules *at volume* easier than ever.","=HYPERLINK(""http://www.ficontec.com"")",ficonTEC Service GmbH  Rehland 8  Achim  Germany  28832
4722,Finetech USA,"=HYPERLINK(""https://spie.org/ExhibitorDetail?ExpoID=5008&ExhibitorID=101527"")","Finetech’s high‐accuracy die bonding equipment supports the most precise & complex applications in advanced packaging, die attach and micro assembly. Sub-micron placement is possible with an extensive range of bonding technologies including thermo-compression, ultrasonic, eutectic, epoxy, sintering, ACF/ACP, Indium. Finetech follows the “Prototype-to-Production” approach to support customers at the development stage and help them transition their processes into production.","=HYPERLINK(""http://www.finetechusa.com"")","Finetech USA  Bldg A  60 State Route 101A  Amherst, NH  United States  03031-2213"
1159,FISBA AG,"=HYPERLINK(""https://spie.org/ExhibitorDetail?ExpoID=5008&ExhibitorID=101644"")","FISBA is an optical innovation company from Switzerland with a well established presence in North America through our team of experts in Saco, Maine. We specialize in highly customized imaging and illumination solutions for medical devices. Our service includes process steps from design & system engineering to volume production of complex microlenses as small as 0.3mm, intricate optical assemblies, imaging and laser and white light modules.","=HYPERLINK(""http://www.fisba.com"")",FISBA AG  Rorschacher Strasse 268  St. Gallen  Switzerland  9016
